No.,Details,Area,Contractor,TypeOfFinding,Topic,CleansingDetails,TransCleansingDetails
2103,งาน Load Chemical (UT-TFU-HH-027) ไม่มี Work permit อยู่หน้างาน (สอบถามหน้างานแจ้งว่า Work อยู่อีกจุด) และเอกสารนำรถเข้า/ Lifting plan ระบุ UT-TFU-HH-028 ซึ่งเป็นงานเปลี่ยน Pump 2415B,UT,Virat K.,Unsafe Action,PTW & JSA,"งาน load chemical (ut-tfu-hh-027) ไม่มี work permit อยู่หน้างาน (สอบถามหน้างานแจ้งว่า work อยู่อีกจุด) , เอกสารนำรถเข้า, lifting plan ระบุ ut-tfu-hh-028 ซึ่งเป็นงานเปลี่ยน pump 2415b","Work load chemical (ut-tfu-hh-027) does not have a work permit in front of the job (inquire at the job site to say that work is at another point), documents to bring the car in, lifting plan specifying ut-tfu-hh-028 which is a job to change pump 2415b"
2104,ทำงานเก็บเศษปูนหน้าเครื่องจักรสกัดปูน,UT,ATP,Unsafe Action,Excavation,ทำงานเก็บเศษปูนหน้าเครื่องจักรสกัดปูน,Work on collecting mortar in front of the cement extraction machine.
2105,ทำงานเป่าลมโดยไม่ได้ระบุงานเป่าลมใน JSA,HOT,HDS,Unsafe Action,Water jet,ทำงานเป่าลมโดยไม่ได้ระบุงานเป่าลมใน jsa,Running blower without specifying blower job in jsa
2106,วางแผ่นนั่งร้านเพื่อยืนทำงานเป่าลม โดยใน JSA ไม่ได้ระบุงานติดตั้งนั่งร้าน,HOT,HDS,Unsafe Action,Work at height,"วางแผ่นนั่งร้าน, ยืนทำงานเป่าลม โดยใน jsa ไม่ได้ระบุงานติดตั้งนั่งร้าน","Placing scaffolding panels, standing work blowing. In jsa, installation of scaffolding is not specified."
2107,งาน Bore scope ไม่ได้สวมถุงมือขณะทำงาน,HOT,A&T,Unsafe Action,PPE,งาน bore scope ไม่ได้สวมถุงมือขณะทำงาน,The bore scope work does not wear gloves while working.
2108,คล้องเกี่ยว Safety Harness กับขั้นบันไดนั่งร้าน ไม่มั่นคงแข็งแรง,HOT,WTM,Unsafe Action,Work at height,"คล้องเกี่ยว safety harness , ขั้นบันไดนั่งร้าน ไม่มั่นคงแข็งแรง","Safety harness , scaffolding steps not strong"
2109,สวมใส่แว่นสายตาขณะปฏิบัติงานรื้อ Insulation,HOT,WTM,Unsafe Action,PPE,สวมใส่แว่นสายตาขณะปฏิบัติงานรื้อ insulation,Wear eyeglasses while working to dismantle insulation.
2110,จุดยืนปฏิบัติงาน Water jet ไม่มีราวกันตก,HOT,HDS,Unsafe Condition,Work at height,จุดยืนปฏิบัติงาน water jet ไม่มีราวกันตก,The water jet operating stand does not have railings.
2111,จอดรถเติมน้ำมันเครื่องจักรในพื้นที่กระบวนการผลิตโดยไม่ได้หนุนล้อ,HOT,HDS,Unsafe Condition,Transportation,จอดรถเติมน้ำมันเครื่องจักรในพื้นที่กระบวนการผลิตโดยไม่ได้หนุนล้อ,Park the machine to refuel the machine in the production area without supporting the wheels.
2112,อุปกรณ์งาน Water jet spec 1400 bar คำนวณแล้วได้ 1.2 เท่า ซึ่งน้อยกว่า 1.5 เท่า (มาตรฐานใน Safe Work Cert.) >> Pressure operating ที่หน้างาน  1200 bar,HOT,HDS,Unsafe Condition,PTW & JSA,อุปกรณ์งาน water jet spec 1400 bar คำนวณแล้วได้ 1.2 เท่า ซึ่งน้อยกว่า 1.5 เท่า (มาตรฐานใน safe work cert.) >> pressure operating ที่หน้างาน 1200 bar,"The water jet spec 1400 bar is calculated 1.2 times, which is 1.5 times less (standard in safe work cert.) >> pressure operating on site 1200 bar"
2113,Steel plate มีน้ำขังและมีมุมแหลมคม เดิน/ ปั่นจักรยานไม่ระวังอาจสะดุดล้มได้,HOT,Pongsak K.,Unsafe Condition,Others,"steel plate มีน้ำขัง, มีมุมแหลมคม เดิน, ปั่นจักรยานไม่ระวังอาจสะดุดล้มได้","steel plate, stagnant water, sharp corners, walking, cycling careless, may stumble and fall."
2114,ทำงานก่อนที่ US Sign PTW >> แจ้งหยุดงานชั่วคราวและแจ้งให้ US มา Sign ก่อนเริ่มงาน,HOT,REPCO (IE),Unsafe Action,PTW & JSA,"ทำงานก่อนที่ us sign ptw >> แจ้งหยุดงานชั่วคราว, แจ้งให้ us มา sign ก่อนเริ่มงาน","Work before us sign ptw >> Temporarily stop work, inform us to sign before starting work"
2115,ดำเนินการขอ Deviation ที่ไม่เป็นไปตามมาตรการที่กำหนดใน SWP Certificate งานขุด (Excavation) “ข้อ 15 จัดให้มีค้ำยัน หรือผนังเอียง 1.5 เท่าของความลึก หรือทำมุม 45 องศา โดยออกแบบให้เหมาะสมกับความลึกของหลุม ความแข็งของดิน” >> ตัด slope 1:1 ป้องกันดินสไลด์,UT,REPCO (OPM),Unsafe Action,Excavation,"ดำเนินการขอ deviation ที่ไม่เป็นไปตามมาตรการที่กำหนดใน swp certificate งานขุด (excavation) “ข้อ 15 จัดให้มีค้ำยัน หรือผนังเอียง 1.5 เท่าของความลึก หรือทำมุม 45 องศา โดยออกแบบให้เหมาะสม, ความลึกของหลุม ความแข็งของดิน” >> ตัด slope 1:1 ป้องกันดินสไลด์","Proceed for deviations that do not comply with the measures specified in the excavation swp certificate “Article 15 provides for support. or a wall tilted 1.5 times the depth or at an angle of 45 degrees by appropriate design, the depth of the hole Soil hardness” >> cut slope 1:1 to prevent soil slide"
2116,ปรับพื้นขั้นบันไดให้เรียบและไม่เสี่ยงต่อการลื่น สะดุด ล้ม,UT,REPCO (OPM),Unsafe Condition,Civil,"ปรับพื้นขั้นบันไดให้เรียบ, ไม่เสี่ยงต่อการลื่น สะดุด ล้ม","Adjust the floor of the stairs to be smooth, not prone to slipping, tripping and falling."
2117,ประเมินความเสี่ยงเรื่องการยกขนย้ายอุปกรณ์เพิ่มเติม เนื่องจากพื้นที่หน้างานมีความเสี่ยงลื่น สะดุด ล้ม,UT,REPCO (OPM),Unsafe Action,PTW & JSA,ประเมินความเสี่ยงเรื่องการยกขนย้ายอุปกรณ์เพิ่มเติม เนื่องจากพื้นที่หน้างานมีความเสี่ยงลื่น สะดุด ล้ม,"Assess the risks of lifting and transporting additional equipment. because the work area is at risk of slipping, tripping, and falling"
2118,การป้องกันจุดแหลมคมของเหล็ก,UT,REPCO (OPM),Unsafe Condition,Civil,การป้องกันจุดแหลมคมของเหล็ก,Protecting the sharp point of steel
2119,แนะนำให้แกะ/ ลอก Sticker inspect อุปกรณ์ที่ไม่ใช่เดือนปัจจุบันออก,HOT,HDS,Unsafe Condition,Tools & Equipment,"แนะนำให้แกะ, ลอก sticker inspect อุปกรณ์ที่ไม่ใช่เดือนปัจจุบันออก","It is recommended to unpack, peel off the sticker, inspect the equipment that is not the current month."
2120,วางอุปกรณ์ไว้ใต้รถ (Line of fire),HOT,HDS,Unsafe Condition,Housekeeping,วางอุปกรณ์ไว้ใต้รถ (line of fire),Put the device under the car (line of fire).
2121,ฝาคอนกรีตรางระบายน้ำชำรุด,UT,Virat K.,Unsafe Condition,Others,ฝาคอนกรีตรางระบายน้ำชำรุด,Broken concrete gutter cover.
2122,สายพานเครื่อง Water jet ขาด 1 เส้น และผู้ควบคุม/ ดูแลเครื่องไม่มีการตัดสินใจที่เด็ดขาด หลังจากเกิดเหตุทันที,HOT,HDS,Near Miss,Water jet,"สายพานเครื่อง water jet ขาด 1 เส้น , ผู้ควบคุม, ดูแลเครื่องไม่มีการตัดสินใจที่เด็ดขาด หลังจากเกิดเหตุทันที","The water jet machine's belt is torn 1 line, the operator, caretaker has no decisive decision. Immediately after the incident"
2123,ทบทวน/ ปรับเปลี่ยนวิธีการ drain น้ำออกจาก Regulator ของ diaphragm pump (เนื่องจากใช้ลม) ควรมีจุด drain โดยไม่ต้องถอดออกทั้งหัว,HOT,HDS,Unsafe Condition,Water jet,"ทบทวน, ปรับเปลี่ยนวิธีการ drain น้ำออกจาก regulator ของ diaphragm pump (เนื่องจากใช้ลม) ควรมีจุด drain โดยไม่ต้องถอดออกทั้งหัว","Review, modify the way to drain the water from the regulator of the diaphragm pump (due to air use) should have a drain point without having to remove the entire head."
2124,Filter ดักสำหรับกรองน้ำหลังจากการ Jet ควรอยู่ Underflow เพื่อกรองทั้ง Particular และ Oil ,HOT,HDS,Unsafe Condition,Water jet,"filter ดักสำหรับกรองน้ำหลังจากการ jet ควรอยู่ underflow , กรองทั้ง particular , oil","filter The trap for filtering water after jetting should be underflow , filtering particular , oil ."
2125,ล้อรถบรรทุกมีรอยแตกขนาด 8 Cm (ซึ่งมี Sticker ผ่านการตรวจสภาพแล้ว),OSBL,HDS,Unsafe Condition,Transportation,ล้อรถบรรทุกมีรอยแตกขนาด 8 cm (ซึ่งมี sticker ผ่านการตรวจสภาพแล้ว),Truck wheels have a crack of size 8 cm (which has a sticker that has been inspected)
2126,สลิงผ้าใบไม่ผ่านการตรวจสภาพ (อยู่ในกล่องเครื่องมือ/ อุปกรณ์),OSBL,RNC,Unsafe Condition,Tools & Equipment,"สลิงผ้าใบไม่ผ่านการตรวจสภาพ (อยู่ในกล่องเครื่องมือ, อุปกรณ์)","The canvas sling has not passed the inspection. (in the toolbox, equipment)"
2127,ไม่มีตาข่ายและไม่มีป้ายเตือนปิดทางเข้า-ออก Fire Box Access door ที่ไม่มีการใช้งาน,HOT,RNC,Unsafe Condition,CSE,"ไม่มีตาข่าย, ไม่มีป้ายเตือนปิดทางเข้า-ออก fire box access door ที่ไม่มีการใช้งาน","No net, no warning signs to close the entrance - exit fire box access door that is not in use."
2128,Fire Watch อ่านค่าวัดแก๊สไม่เป็น,UT,PROTECH,Unsafe Action,Hot Work,fire watch อ่านค่าวัดแก๊สไม่เป็น,fire watch can't read gas meter
2129,Fire Watch ไม่เพียงพอ (เป็น Hole Watch 1 คน อีก 1 คน เป็น Fire Watch อยู่ที่ชั้น 6),HOT,RNC,Unsafe Action,Hot Work,fire watch ไม่เพียงพอ (เป็น hole watch 1 คน อีก 1 คน เป็น fire watch อยู่ที่ชั้น 6),"Not enough fire watch (one hole watch, another one is fire watch on the 6th floor)"
2130,สาย Water jet วางพาดกับขอบ Structure มีโอกาสชำรุดได้ (ให้ติดตั้งท่อนั่งร้านเพื่อวางสายพาด),HOT,HDS,Unsafe Condition,Water jet,"สาย water jet วางพาด, ขอบ structure มีโอกาสชำรุดได้ (ให้ติดตั้งท่อนั่งร้าน, วางสายพาด)","The water jet line is placed across the structure, the edge of the structure is likely to be damaged. (to install scaffolding pipes, place a belt)"
2131,นำเชือกฟางผูกมัดสาย Water jet (เป็นวัสดุติดไฟง่ายและอยู่ในบริเวณที่มีความร้อนสูง),HOT,HDS,Unsafe Condition,Water jet,"นำเชือกฟางผูกมัดสาย water jet (เป็นวัสดุติดไฟง่าย, อยู่ในบริเวณที่มีความร้อนสูง)","Use a straw rope to tie the water jet cable (combustible material, in high heat areas)."
2132,Water jet ชั้น6 ปิดล้อมพื้นที่โดยไม่มีการเปิดช่องทางเข้า-ออกสำหรับผู้ปฏิบัติงาน,HOT,HDS,Unsafe Condition,Water jet,water jet ชั้น6 ปิดล้อมพื้นที่โดยไม่มีการเปิดช่องทางเข้า-ออกสำหรับผู้ปฏิบัติงาน,The 6th floor water jet encloses the area with no openings for operator access.
2133,ขณะที่ FO. Routine check sheet ตามปกติได้พบสายสัญญาณของ CT-S300 NDE เกิดความเสียหายเนื่องจากความร้อนของ Steam SS Turbine โดยสายสัญญาณที่เกิดความเสียหายมี 3 เส้น ซึ้งหนึ่งในนั้นเป็นสายสัญญาณที่สำคัญ สามารถสั่ง TRIP CT-S300 ลงได้ ได้แก่ VYE-S399-13B เป็นสายสัญญาณวัด TURBINE RADIAL VIBRATION HIGH TRIP CT-S300 (การทำงานของคำสั่ง trip จะใช้การโหวด 2 ใน 4) ในกรณีที่สายสัญญาณ VYE-S399-13B เสียหายจนไม่สามารถ Monitor ได้ส่งผลทำให้จากที่ BM. ใช้ค่าที่วัดได้จากสายสัญญาณที่ 4 เส้นเพื่อดู Condition Turbine กลับเหลือประสิทธิภาพในการ Monitor ลดลงจาก 100% เป็น 75% แต่คำสั่ง Trip ยังทำงานเหมือนเดิม ถ้าในขณะนั้นเกิด Upset Condition ขึ้นก็มีความเสี่ยงที่คำสั่ง TRIP CT-S300 จะทำงาน,Olefins2,MOC (OPE),Near Miss,Process & Operation,"ขณะที่ fo. routine check sheet ตามปกติได้พบสายสัญญาณของ ct-s300 nde เกิดความเสียหายเนื่องจากความร้อนของ steam ss turbine โดยสายสัญญาณที่เกิดความเสียหายมี 3 เส้น ซึ้งหนึ่งในนั้นเป็นสายสัญญาณที่สำคัญ สามารถสั่ง trip ct-s300 ลงได้ ได้แก่ vye-s399-13b เป็นสายสัญญาณวัด turbine radial vibration high trip ct-s300 (การทำงานของคำสั่ง trip จะใช้การโหวด 2 ใน 4) ในกรณีที่สายสัญญาณ vye-s399-13b เสียหายจนไม่สามารถ monitor ได้ส่งผลทำให้จากที่ bm. ใช้ค่าที่วัดได้จากสายสัญญาณที่ 4 เส้น, ดู condition turbine กลับเหลือประสิทธิภาพในการ monitor ลดลงจาก 100% เป็น 75% แต่คำสั่ง trip ยังทำงานเหมือนเดิม ถ้าในขณะนั้นเกิด upset condition ขึ้นก็มีความเสี่ยงที่คำสั่ง trip ct-s300 จะทำงาน","The routine fo. check sheet found that the ct-s300 nde's signal cable was damaged due to the heat of the steam ss turbine, with three damaged signal cables, one of which was a critical one. A trip can be ordered. ct-s300 vye-s399-13b is a turbine radial vibration high trip signal cable ct-s300 (operation of trip commands use 2 out of 4 votes) in case the vye-s399-13b cable is damaged until Failed to monitor resulted in bm. Using the measured value on 4 wires, the condition turbine showed a drop in monitor efficiency from 100% to 75%, but the trip command still works the same. If at that moment an upset condition occurs, there is a risk that the trip ct-s300 command will run."
2134,นำถุงมือยางมาผูกเป็น Stopper ของสายแรงดัน,HOT,HDS,Unsafe Condition,Water jet,นำถุงมือยางมาผูกเป็น stopper ของสายแรงดัน,Use rubber gloves to tie them as a stopper of the pressure line.
2135,น้ำ Water jet รั่วจากถาดรอง (แจ้งทีม HDS ให้ไล่ขัน Nut),HOT,HDS,Unsafe Condition,Water jet,น้ำ water jet รั่วจากถาดรอง (แจ้งทีม hds ให้ไล่ขัน nut),Water jet leaking from the tray (inform the hds team to remove the nut)
2136,ทำงานถอดประกอบอุปกรณ์ที่มีแสงสว่างไม่เพียงพออาจเกิดอันตรายจากการใช้เครื่องมือได้,HOT,RNC,Unsafe Condition,Safety Management,ทำงานถอดประกอบอุปกรณ์ที่มีแสงสว่างไม่เพียงพออาจเกิดอันตรายจากการใช้เครื่องมือได้,Work on disassembling equipment with insufficient lighting can be dangerous when using the tool.
2137,ช่องเปิดบนนั่งร้าน (ที่เปิดทิ้งไว้เพื่อรอหย่อน Pipe) >> ให้ดำเนินการไล่ปิดทุกจุด จุดไหนที่จะมีการทำงานให้จัดทีมนั่งร้านมา modify และแจ้ง Safety/ Requestor ทราบ,UT,WTM,Unsafe Condition,Scaffolding,"ช่องเปิดบนนั่งร้าน (ที่เปิดทิ้งไว้, รอหย่อน pipe) >> ให้ดำเนินการไล่ปิดทุกจุด จุดไหนที่จะมีการทำงานให้จัดทีมนั่งร้านมา modify , แจ้ง safety, requestor ทราบ","openings on scaffolding (Leave open, wait to drop the pipe) >> proceed to chase off all points. Where there will be work to arrange a scaffolding team to modify, inform safety, requestor know"
2138,ทำงาน HW I โดยไม่ได้เปิด PTW (พบใช้ PTW ของ HW I ชั้น 1),HOT,RNC,Unsafe Action,PTW & JSA,ทำงาน hw i โดยไม่ได้เปิด ptw (พบใช้ ptw ของ hw i ชั้น 1),working hw i without opening ptw (found using ptw of hw i level 1)
2139,ตู้ไฟยังไม่ได้ต่อสาย Ground,HOT,HDS,Unsafe Condition,Electrical & Grounding,ตู้ไฟยังไม่ได้ต่อสาย ground,The power box is not connected to ground.
2140,นำรอกมาแขวนกับนั่งร้านขณะถอดฝา,HOT,RNC,Unsafe Condition,Lifting,"นำรอกมาแขวน, นั่งร้านขณะถอดฝา","Bring the pulley to hang, scaffolding while removing the lid."
2141,Man basket ขนย้ายอุปกรณ์ไม่มีตะแกรงป้องกันของตก (แก้ไขชั่วคราวโดยการนำผ้าใบมาปูรอง),HOT,RNC,Unsafe Condition,Lifting,man basket ขนย้ายอุปกรณ์ไม่มีตะแกรงป้องกันของตก (แก้ไขชั่วคราวโดยการนำผ้าใบมาปูรอง),man basket to transport equipment without a net to prevent falling objects (temporarily modified by bringing the canvas to cover)
2142,น็อตยึดฝา TLE lock ไม่แน่น,HOT,REPCO (MES),Unsafe Condition,Others,น็อตยึดฝา tle lock ไม่แน่น,The lock nut is not tight.
2143,แสงสว่างชั้น 4 ไม่เพียงพอ,HOT,RNC,Unsafe Condition,Safety Management,แสงสว่างชั้น 4 ไม่เพียงพอ,Floor 4 lighting is insufficient.
2144,ระหว่าง Log Sheet ได้พบเห็น LG-S277 ของ Z-S229 (Tank Chemicals) Leak ออกมา หากติดไฟอาจทำให้เกิดการลุกไหม้ได้,Olefins2,MOC (OPE),Near Miss,Process & Operation,ระหว่าง log sheet ได้พบเห็น lg-s277 ของ z-s229 (tank chemicals) leak ออกมา หากติดไฟอาจทำให้เกิดการลุกไหม้ได้,"Between the log sheets, lg-s277 of the z-s229 (tank chemicals) leaked out. If ignited it may cause a fire."
2145,งานประกอบฝา drain น้ำ Water jet ชั้น 4 ปฏิบัติงานบริเวณช่องเปิดแต่ไม่ได้เตรียม Safety Harness มาใช้งาน,HOT,HDS,Unsafe Action,Work at height,งานประกอบฝา drain น้ำ water jet ชั้น 4 ปฏิบัติงานบริเวณช่องเปิดแต่ไม่ได้เตรียม safety harness มาใช้งาน,"Assembling the water drain cover on the 4th floor, working around the opening but not preparing the safety harness for use."
2146,ติดตั้งนั่งร้านสำหรับเคลื่อนย้าย Trolley beam กีดขวางทางเดิน,HOT,RNC,Unsafe Condition,Scaffolding,ติดตั้งนั่งร้านสำหรับเคลื่อนย้าย trolley beam กีดขวางทางเดิน,Install scaffolding to move the trolley beam to block the walkway.
2147,ช่องเปิด Grating ด้านหน้า Fire Box Access door ชั้น 1 ,HOT,RNC,Unsafe Condition,Work at height,ช่องเปิด grating ด้านหน้า fire box access door ชั้น 1,"grating opening in front of fire box access door, 1st floor"
2148,อุปกรณ์นั่งร้านและถุงใส่ Insulation วางกีดขวางทางขึ้น-ลงชั้น Convection,HOT,RNC,Unsafe Condition,Housekeeping,"อุปกรณ์นั่งร้าน, ถุงใส่ insulation วางกีดขวางทางขึ้น-ลงชั้น convection","Scaffolding equipment, insulating bag placed to block the way up and down the convection floor."
