No.,Details,Area,Contractor,TypeOfFinding,Topic,CleansingDetails,TransCleansingDetails
672,ปิดกั้น Barricade ไม่ครอบคลุม จุดปฏิบัติงาน,HOT,RNC,Unsafe Condition,Scaffolding,ปิดกั้น barricade ไม่ครอบคลุม จุดปฏิบัติงาน,"Block the barricade, do not cover the point of operation."
673,งาน Load Polymer ผู้ปฏิบัติงานยืนควบคุม Tag line บน Hiab เสี่ยงต่อการตกลงมาจากหลังรถ,HOT,NALCO,Unsafe Action,Lifting,งาน load polymer ผู้ปฏิบัติงานยืนควบคุม tag line บน hiab เสี่ยงต่อการตกลงมาจากหลังรถ,Load polymer work. Operator stands in control of the tag line on the hiab. Risk of falling from the back of the car.
674,สวมถุงมือผ้าในงาน Swing Blind,Olefins2,MGB,Unsafe Action,PPE,สวมถุงมือผ้าในงาน swing blind,Wear cloth gloves in swing blind work.
675,ไม่มีหมอนรองรถ Hiab ที่ใช้ในการขนย้ายอุปกรณ์นั่งร้าน,TFU,WTM,Unsafe Condition,Transportation,ไม่มีหมอนรองรถ hiab ที่ใช้ในการขนย้ายอุปกรณ์นั่งร้าน,There are no hiab car cushions used to transport scaffolding equipment.
676,SL งานรื้อนั่งร้านไม่มี Safety Harness,HOT,RNC,Unsafe Action,Scaffolding,sl งานรื้อนั่งร้านไม่มี safety harness,sl scaffolding work without safety harness
677,รถเข็นอุปกรณ์นั่งร้าน modify ใช้งานไม่เป็นไปตามข้อกำหนด,HOT,ATI-LT,Unsafe Condition,Scaffolding,รถเข็นอุปกรณ์นั่งร้าน modify ใช้งานไม่เป็นไปตามข้อกำหนด,Scaffolding cart modify Not working according to the requirements.
678,งาน install calibration cell ไม่สวมถุงมือก่อนเริ่มทำงาน,ARU,PROTECH,Unsafe Action,Installation/ Alignment,งาน install calibration cell ไม่สวมถุงมือก่อนเริ่มทำงาน,Install calibration cell work without gloves before starting work.
679,พนักงานขับรถลืมสวมใส่หมวก,OCU,LINDE,Unsafe Action,Transportation,พนักงานขับรถลืมสวมใส่หมวก,The driver forgot to wear a helmet.
680,Metal sheet ค้างด้านบน,UT,MOC (OPE),Unsafe Condition,Housekeeping,metal sheet ค้างด้านบน,metal sheet stuck on top
681,Metal sheet และอุปกรณ์นั่งร้านค้างอยู่ด้านบน,UT,MOC (OPE),Unsafe Condition,Housekeeping,"metal sheet , อุปกรณ์นั่งร้านค้างอยู่ด้านบน","metal sheet , scaffolding device on top"
682,เศษเหล็กวางทิ้งไว้,HOT,TTCL,Unsafe Condition,Housekeeping,เศษเหล็กวางทิ้งไว้,scrap iron left behind
683,ไม่สวมใส่ชุด Tyvek ขณะทำงาน,Olefins2,RNC,Unsafe Action,Insulation,ไม่สวมใส่ชุด tyvek ขณะทำงาน,Do not wear tyvek while working.
684,Hole watch สวมใส่หมวก ไม่ตรงตามตำแหน่ง (หมวกสีแดง),Olefins2,RNC,Unsafe Action,CSE,hole watch สวมใส่หมวก ไม่ตรงตามตำแหน่ง (หมวกสีแดง),hole watch wearing a hat that doesn't match the position (red hat)
685,Hole watch และหัวหน้างานไม่มีวิทยุสื่อสารกับผู้ปฏิบัติงานด้านใน,Olefins2,QUALITECH,Unsafe Action,CSE,"hole watch , หัวหน้างานไม่มีวิทยุสื่อสาร, ผู้ปฏิบัติงานด้านใน","hole watch , the supervisor does not have a radio, the worker inside"
686,งาน Replied Wall ผู้ปฏิบัติงานไม่สวมถุงมือขณะปฏิบัติงาน,Olefins2,QUALITECH,Unsafe Action,PPE,งาน replied wall ผู้ปฏิบัติงานไม่สวมถุงมือขณะปฏิบัติงาน,"Work replied wall, the operator does not wear gloves while working."
687,ใช้สลิงผ้าใบผูกเสาเข็ม เพื่อลากเข้าไปด้านใต้อุปกรณ์ติดตั้ง Support  จึงทำให้สลิงผ้าใบขาดชำรุด,OSBL,PROFESS,Unsafe Action,Tools & Equipment,"ใช้สลิงผ้าใบผูกเสาเข็ม , ลากเข้าไปด้านใต้อุปกรณ์ติดตั้ง support จึงทำให้สลิงผ้าใบขาดชำรุด","Use a canvas sling to tie a pile, drag it under the support installation device, causing the canvas sling to be torn and damaged."
688,โครงสร้างนั่งร้านฐานล่างไม่แข็งแรง ,TFU,PROTECH,Unsafe Condition,Scaffolding,โครงสร้างนั่งร้านฐานล่างไม่แข็งแรง,The lower base scaffolding structure is not strong.
689,"บัตร SL งานติดตั้ง Compact, Prove meter หมดอายุ (3 คน)",TFU,FLOWLAB,Unsafe Action,Work Procedure,"บัตร sl งานติดตั้ง compact , prove meter หมดอายุ (3 คน)","sl card installation work compact , prove meter expired (3 people)"
690,ผู้ปฏิบัติงานขึ้นไปเหยียบบนขอบ Scrubber ขณะเปลี่ยน activate carbon,HOT,REPCO (ME),Unsafe Action,Work at height,ผู้ปฏิบัติงานขึ้นไปเหยียบบนขอบ scrubber ขณะเปลี่ยน activate carbon,The operator stepped on the edge of the scrubber while changing the activate carbon.
691,ผู้ปฏิบัติงานไม่สวมใส่ mask ป้องกัน ขณะเปลี่ยน activate carbon,HOT,REPCO (ME),Unsafe Action,Chemical Work,ผู้ปฏิบัติงานไม่สวมใส่ mask ป้องกัน ขณะเปลี่ยน activate carbon,Operators do not wear protective masks while changing activate carbon.
692,วางสายไฟกับพื้นที่มีลักษณะเปียก,Olefins2,RNC,Unsafe Condition,Electrical & Grounding,"วางสายไฟ, พื้นที่มีลักษณะเปียก","Lay wires, wet areas."
693,ใช้เชือกฟางมัดสายไฟ,Olefins2,SRIC,Unsafe Condition,Electrical & Grounding,ใช้เชือกฟางมัดสายไฟ,Use straw rope to tie the wires.
694,นำกล่องกระดาษรองสายไฟที่พาดกับ Handrail,Olefins2,SRIC,Unsafe Condition,Electrical & Grounding,"นำกล่องกระดาษรองสายไฟที่พาด, h, rail","Take a paper box to line the wires, h, rail."
695,สายไฟวางพาด Open hole โดยไม่มีผ้ารองกันบาด,Olefins2,SRIC,Unsafe Condition,Electrical & Grounding,สายไฟวางพาด open hole โดยไม่มีผ้ารองกันบาด,The power cord is laid across an open hole with no cut-proof cloth.
696,จุดวางถังน้ำดื่มตั้งอยู่บริเวณที่มีการปฏิบัติงานด้านบน (Line of fire),Olefins2,VPP,Unsafe Condition,Housekeeping,จุดวางถังน้ำดื่มตั้งอยู่บริเวณที่มีการปฏิบัติงานด้านบน (line of fire),Drinking water tank placement is located at the top of the line of fire.
697,งาน Refactory วาง Big Bag ที่เป็น Waste ทิ้งไว้โดยไม่ได้ปิดล้อมพื้นที่,Olefins2,VPP,Unsafe Condition,Housekeeping,งาน refactory วาง big bag ที่เป็น waste ทิ้งไว้โดยไม่ได้ปิดล้อมพื้นที่,Refactory work. Put big bags that are waste away without enclosing the area.
698,งานถอดประกอบอุปกรณ์มีการนำขวดน้ำอัดลมบรรจุน้ำยาล้างจาน,Olefins2,RNC,Unsafe Action,Installation/ Alignment,งานถอดประกอบอุปกรณ์มีการนำขวดน้ำอัดลมบรรจุน้ำยาล้างจาน,The disassembly of the equipment is to bring a bottle of soft drink filled with dishwashing liquid.
699,งาน Remove motor pump ผู้ปฏิบัติงานไม่สวมถุงมือปฏิบัติงาน,ARU,U-SERVICE,Unsafe Action,Installation/ Alignment,งาน remove motor pump ผู้ปฏิบัติงานไม่สวมถุงมือปฏิบัติงาน,Remove motor pump worker does not wear gloves.
700,งานตัดผนัง ผู้ปฏิบัติงานใช้เครื่องเจียรไม่มี Handle,Olefins2,RNC,Unsafe Condition,Hot Work,"งานตัดผนัง ผู้ปฏิบัติงานใช้เครื่องเจียรไม่มี h, le","Wall cutting. The operator uses a grinding machine without h, le."
701,ข้อต่อสาย Ground ตู้เชื่อมไม่แน่นและใช้งานมานาน อยู่ในสภาพไม่พร้อมใช้งาน,Olefins2,RNC,Unsafe Condition,Electrical & Grounding,"ข้อต่อสาย ground ตู้เชื่อมไม่แน่น, ใช้งานมานาน อยู่ในสภาพไม่พร้อมใช้งาน","Ground cable connection. The connection cabinet is not tight, has been used for a long time, is in a state of being unusable."
702,"ถังดับเพลิง Tag หมดอายุตั้งแต่ปี 2020, หน้าปัดแตก, Pressure เป็นศูนย์",Olefins2,MYC,Unsafe Condition,Tools & Equipment,"ถังดับเพลิง tag หมดอายุตั้งแต่ปี 2020 , หน้าปัดแตก , pressure เป็นศูนย์","Fire extinguisher tag expires in 2020, broken dial, zero pressure."
703,งานขัดสนิมไม่สวมใส่ PPE ตามมาตรการที่กำหนดใน JSA,Olefins2,TTCL,Unsafe Action,Paint/ Coat/ Blast,งานขัดสนิมไม่สวมใส่ ppe ตามมาตรการที่กำหนดใน jsa,Rust polishing work not wearing ppe according to measures given in jsa
704,งานทาสีในบ่อ เปิด PTW งาน HW II (OLE2-LH-002) ผู้ขออนุญาต สรวัฒน์,Olefins2,TTCL,Unsafe Action,CSE,งานทาสีในบ่อ เปิด ptw งาน hw ii (ole2-lh-002) ผู้ขออนุญาต สรวัฒน์,Painting work in the pond open ptw work hw ii (ole2-lh-002) Applicant Sorawat
705,งานถอดประกอบ/ Swing Blind ผู้ปฏิบัติงานยืนปฏิบัติงานในบริเวณของ Line of fire ,Olefins2,RNC,Unsafe Action,Installation/ Alignment,"งานถอดประกอบ, swing blind ผู้ปฏิบัติงานยืนปฏิบัติงานในบริเวณของ line of fire","Disassembly work, swing blind. Operator stands in line of fire area."
706,งานติดตั้งนั่งร้าน ปิดล้อมพื้นที่ไม่ครอบคลุมจุดปฏิบัติงาน,Olefins2,ATI-LT,Unsafe Condition,Scaffolding,งานติดตั้งนั่งร้าน ปิดล้อมพื้นที่ไม่ครอบคลุมจุดปฏิบัติงาน,scaffolding installation Enclose an area that does not cover the point of operation.
707,งานยก/ขนย้ายอุปกรณ์ ใช้สะเก็นที่ไม่มี Tag inspect ,Olefins2,KEC,Unsafe Action,Lifting,"งานยก, ขนย้ายอุปกรณ์ ใช้สะเก็นที่ไม่มี tag inspect","Lifting work, moving equipment Use a shard without an inspect tag."
708,งานติดตั้งนั่งร้าน ปิดล้อมพื้นที่ไม่ครอบคลุมจุดปฏิบัติงาน,Olefins2,TTCL,Unsafe Condition,Scaffolding,งานติดตั้งนั่งร้าน ปิดล้อมพื้นที่ไม่ครอบคลุมจุดปฏิบัติงาน,scaffolding installation Enclose an area that does not cover the point of operation.
709,จุด Connect สาย Ground ไม่แน่น,TFU,PROTECH,Unsafe Condition,Electrical & Grounding,จุด connect สาย ground ไม่แน่น,The connection point of the ground cable is not tight.
710,ผู้ปฏิบัติงานติดตั้งนั่งร้าน อยู่ในจุดLine of fire,UT,WTM,Unsafe Action,Scaffolding,ผู้ปฏิบัติงานติดตั้งนั่งร้าน อยู่ในจุดline of fire,worker installing scaffolding in the line of fire
711,เศษไม้ ผ้าใบ และอุปกรณ์ ไม่มีการจัดเก็บออกจากพื้นที่,Olefins2,TTCL,Unsafe Condition,Housekeeping,"เศษไม้ ผ้าใบ , อุปกรณ์ ไม่มีการจัดเก็บออกจากพื้นที่","Scraps of wood, canvas, equipment are not stored out of the area."
712,วางอุปกรณ์นั่งร้านกีดขวางทางขึ้นลงบันไดนั่งร้าน,Olefins2,TTCL,Unsafe Condition,Housekeeping,วางอุปกรณ์นั่งร้านกีดขวางทางขึ้นลงบันไดนั่งร้าน,Place scaffolding equipment blocking the way up and down the scaffolding stairs.
713,นั่งร้านไม่มี Tag inspect,Olefins2,TTCL,Unsafe Condition,Scaffolding,นั่งร้านไม่มี tag inspect,Scaffolding without tag inspect
714,ผู้ปฏิบัติงานทาสี สวมใส่แว่นตาแฟชั่น,Olefins2,TTCL/ PSA,Unsafe Action,Paint/ Coat/ Blast,ผู้ปฏิบัติงานทาสี สวมใส่แว่นตาแฟชั่น,paint worker wear fashion glasses
715,ปิดล้อมพื้นที่ไม่ครอบคลุม,Olefins2,ATI-LT,Unsafe Condition,Scaffolding,ปิดล้อมพื้นที่ไม่ครอบคลุม,enclosing areas that are not covered
716,กองเก็บอุปกรณ์นั่งร้านโดยไม่มี Barricade กั้น,HOT,KAEFER,Unsafe Condition,Housekeeping,กองเก็บอุปกรณ์นั่งร้านโดยไม่มี barricade กั้น,Scaffolding storage piles without barriers
717,ผู้บังคับ Hiab งานถอดและยกฝา cover motor ไม่มีเสื้อสะท้อนแสง,UT,REPCO,Unsafe Action,Lifting,"ผู้บังคับ hiab งานถอด, ยกฝา cover motor ไม่มีเสื้อสะท้อนแสง","Hiab commander. Remove work, lift motor cover without reflective vest."
718,SL งานตัดเปลี่ยน Valve line drainไม่อยู่ในพื้นที่การทำงาน และไม่ได้แจ้งให้หัวหน้างานทราบ,COLD,MYC,Unsafe Action,SL Performance,"sl งานตัดเปลี่ยน valve line drainไม่อยู่ในพื้นที่การทำงาน , ไม่ได้แจ้งให้หัวหน้างานทราบ","sl cut off valve line drain not in the working area , not notified to supervisor"
719,ใช้ประแจตีโดยไม่มีเชือกผูกอุปกรณ์ งาน Swing Blind,COLD,REPCO,Unsafe Action,LOTO/ LB,ใช้ประแจตีโดยไม่มีเชือกผูกอุปกรณ์ งาน swing blind,Use a wrench to hit without a rope. Swing blind work.
720,นำรถเข็นที่ไม่ได้มาตรฐานเข้ามาใช้งานในเขตกระบวนการผลิต,Olefins2,TTCL,Unsafe Condition,Tools & Equipment,นำรถเข็นที่ไม่ได้มาตรฐานเข้ามาใช้งานในเขตกระบวนการผลิต,Bringing non-standard carts into production zones
721,ผู้ปฏิบัติงาน งานติดตั้ง Air Compressor ไม่สวมใส่ถุงมือ,UT,REPCO (MER),Unsafe Action,Installation/ Alignment,ผู้ปฏิบัติงาน งานติดตั้ง air compressor ไม่สวมใส่ถุงมือ,Operators installing air compressors do not wear gloves.
722,ผู้ปฏิบัติงาน งานยกติดตั้ง Air compressor ไม่สวมใส่เสื้อสะท้อนแสง,UT,REPCO (MER),Unsafe Action,Lifting,ผู้ปฏิบัติงาน งานยกติดตั้ง air compressor ไม่สวมใส่เสื้อสะท้อนแสง,Operators who install air compressors do not wear reflective clothing.
723,นำสลิงผ้าใบที่ไม่มีการตรวจสอบ(ไม่ติด sticker)มาใช้งาน,UT,REPCO (MER),Unsafe Condition,Lifting,นำสลิงผ้าใบที่ไม่มีการตรวจสอบ(ไม่ติด sticker)มาใช้งาน,Bring an unchecked canvas sling (not attached sticker) come to use
724,ไม่สวมใส่ถุงมือก่อนเริ่มปฏิบัติงาน,COLD,WTM,Unsafe Action,Insulation,ไม่สวมใส่ถุงมือก่อนเริ่มปฏิบัติงาน,Do not wear gloves before starting work.
725,ไม่มีการปิดล้อมพื้นที่ขณะปฏิบัติงานบนที่สูง (งานขัน Bolt),HOT,PROTECH,Unsafe Condition,Installation/ Alignment,ไม่มีการปิดล้อมพื้นที่ขณะปฏิบัติงานบนที่สูง (งานขัน bolt),No enclosing area when working at height (bolt work)
726,วางอุปกรณ์นั่งร้านกีดขวาง Hose Box,OCU,WTM,Unsafe Condition,Housekeeping,วางอุปกรณ์นั่งร้านกีดขวาง hose box,Place scaffolding equipment to obstruct the hose box.
727,ใช้งานหินเจียรโดยไม่มี Handle,COLD,PROTECH,Unsafe Condition,Hot Work,"ใช้งานหินเจียรโดยไม่มี h, le","Use a grinding wheel without h, le."
728,สวมใส่แว่นตาแฟชั่นปฏิบัติงาน Install Platform,ARU,PROTECH,Unsafe Action,PPE,สวมใส่แว่นตาแฟชั่นปฏิบัติงาน install platform,"Wear fashion glasses, perform work, install platform"
729,ผจส. ความปลอดภัยยังไม่ได้ Sign Rescue plan (งาน Remove PSV) ,ARU,REPCO (EE),Unsafe Action,CSE,ผจส. ความปลอดภัยยังไม่ได้ sign rescue plan (งาน remove psv),Safety manager hasn't signed rescue plan (remove psv job)
730,ผู้ขออนุญาตนำ Work ออกมาด้านนอก เนื่องจากผู้ปฏิบัติงาน ยังไม่ได้ติด Sticker (มีเอกสารยืนยันแต่ SD ยังไม่ได้ verify),ARU,REPCO (EE),Unsafe Action,CSE,ผู้ขออนุญาตนำ work ออกมาด้านนอก เนื่องจากผู้ปฏิบัติงาน ยังไม่ได้ติด sticker (มีเอกสารยืนยันแต่ sd ยังไม่ได้ verify),"The applicant asked for permission to bring the work outside because the worker has not yet attached the sticker (there is a confirmation document, but the sd has not been verified)."
731,ปิดล้อม Barricade ไม่ครอบคลุม งาน welding support,Olefins2,TTCL,Unsafe Condition,Hot Work,ปิดล้อม barricade ไม่ครอบคลุม งาน welding support,siege barricade not covering work welding support
732,ยืนบนถังเพื่อทาสี,Olefins2,TTCL/ PSA,Unsafe Condition,Paint/ Coat/ Blast,"ยืนบนถัง, ทาสี","stand on the bucket, paint"
733, UT-LH-005 งาน Function test ไม่ได้แขวน Tag ที่อุปกรณ์ LOTO ,TFU,MOC (OPE),Unsafe Action,LOTO/ LB,ut-lh-005 งาน function test ไม่ได้แขวน tag ที่อุปกรณ์ loto,ut-lh-005 function test not hanging tag on loto device
734,ไม่ได้ถอนติดตั้ง Ground rod หลังจบงาน,Olefins2,TTCL,Unsafe Condition,Electrical & Grounding,ไม่ได้ถอนติดตั้ง ground rod หลังจบงาน,The ground rod was not removed after the job was completed.
735,จัดเก็บอุปกรณ์นั่งร้านไม่เป็นระเบียบ,Olefins2,TTCL/ RSC,Unsafe Condition,Housekeeping,จัดเก็บอุปกรณ์นั่งร้านไม่เป็นระเบียบ,Organized storage of scaffolding equipment
736,ทางขึ้นลงบันไดนั่งร้านไม่ Handrail กันตก,HOT,MOC (OPE),Unsafe Condition,Scaffolding,"ทางขึ้นลงบันไดนั่งร้านไม่ h, rail กันตก","The way up and down the stairs scaffolding is not h, rail to prevent falling."
737,หุ้ม Insulation นอกจุดที่ระบุใน Work permit,HOT,WTM,Unsafe Action,Work Procedure,หุ้ม insulation นอกจุดที่ระบุใน work permit,Cover insulation outside the point specified in the work permit.
738,นำไม้เข้ามาใน Plant และวางไว้ที่ขอบปูน เสี่ยงต่อการสะดุด,UT,REPCO,Unsafe Condition,Housekeeping,"นำไม้เข้ามาใน plant , วางไว้ที่ขอบปูน เสี่ยงต่อการสะดุด","Bring the wood into the plant, place it on the edge of the mortar. risk of tripping"
739,"ไม่มีStep ในการขึ้นลง, เหยียบท่อหรืออุปกรณ์และทำงานในพื้นที่คับแคบ (Line of fire)",UT,REPCO,Unsafe Action,Installation/ Alignment,"ไม่มีstep ในการขึ้นลง , เหยียบท่อหรืออุปกรณ์, ทำงานในพื้นที่คับแคบ (line of fire)","No steps to climb, step on pipes or equipment, work in confined spaces (line of fire)."
740,ระบุ JSA ไม่ครอบคลุมขั้นตอนการปฏิบัติงาน (เรื่องท่าทางการทำงานในพื้นที่คับแคบ),UT,REPCO,Unsafe Action,PTW & JSA,ระบุ jsa ไม่ครอบคลุมขั้นตอนการปฏิบัติงาน (เรื่องท่าทางการทำงานในพื้นที่คับแคบ),Specify jsa does not cover operational procedures. (about working posture in confined spaces)
741,มีการแก้ไขประเภทของ PTW จาก LC (Scaffolding) เป็น LH เพื่อเพิ่มงาน Insulation ,Olefins2,WTM,Unsafe Action,Work Procedure,"มีการแก้ไขประเภทของ ptw จาก lc (scaffolding) เป็น lh , เพิ่มงาน insulation","The type of ptw was modified from lc (scaffolding) to lh , increased insulation work."
742,นำรถเข็นน้ำขนย้ายอุปกรณ์นั่งร้าน,Olefins2,TTCL,Unsafe Condition,Scaffolding,นำรถเข็นน้ำขนย้ายอุปกรณ์นั่งร้าน,Bring a water cart to move the scaffolding equipment.
