FindingNo,Area,SubArea,Contractor,TypeOfFinding,Topic,Details,Frequency,CleansingDetails,TranslateDetails
3702,Catalyst&Pilot plant,Unknown,Unknown,Unsafe Action,Unknown,"ตรวจสอบพบ ข้อ1.1 Permit Requester ลงชื่อนายก่อเกียรติ (ผู้ขออนุญาต) ไม่ได้เข้าทำงาน
ข้อ 3 Permit Requester ลงชื่อนายดำรงเกียรติ ในการขอเปิดงาน 
เอกสาร Safe Work Certificate และ JSA ในเอกสารลงชื่อนายก่อเกียรติ ผู้ขออนุญาต เพราะเอกสาร Safe Work Checklist จะต้องมีการตรวจสอบที่หน้างานก่อนเริ่มทำงานเพื่อความปลอดภัย คนที่ลงชื่อไว้ไม่ได้เข้ามาทำงาน",2,"ตรวจสอบพบ ข้อ1.1 permit requester ลงชื่อนายก่อเกียรติ (ผู้ขออนุญาต) ไม่ได้เข้าทำงาน, ข้อ 3 permit requester ลงชื่อนายดำรงเกียรติ ในการขอเปิดงาน , เอกสาร safe work certificate , jsa ในเอกสารลงชื่อนายก่อเกียรติ ผู้ขออนุญาต เพราะเอกสาร safe work checklist จะต้องมีการตรวจสอบที่หน้างานก่อนเริ่มทำงาน, ความปลอดภัย คนที่ลงชื่อไว้ไม่ได้เข้ามาทำงาน","Check found item 1.1 permit requester signed by Mr. Korkiat. (Applicant) did not go to work, item 3 permit requester signed Mr. Damrongkiat To request a job opening, a safe work certificate, jsa in the document signed by Mr. Korkiat, the applicant for permission, because the safe work checklist document must be checked at the job site before starting work, security, the person who signed it did not come to work."
2988,Bagging Site1,Unknown,Unknown,Unsafe Condition,Unknown,บันไดที่วางอยู่ตรงชั้นบนสุดตรงทางออกไปชั้นลอย ไม่ได้ตรวจสภาพ ( ตรวจล่าสุดตามสติ๊กเกอร์ที่ติดอยู่คือเดือนเมษายน ),1,บันไดที่วางอยู่ตรงชั้นบนสุดตรงทางออกไปชั้นลอย ไม่ได้ตรวจสภาพ ( ตรวจล่าสุดตามสติ๊กเกอร์ที่ติดอยู่คือเดือนเมษายน ),A staircase placed on the top floor at the exit to the mezzanine level. Did not check the condition (the latest check according to the sticker attached is April)
2994,Catalyst&Pilot plant,Unknown,Unknown,Unsafe Action,Unknown,ตรวจสอบพบเอกสาร SE-F-0277 Rev 006 พบการตรวจสอบสุขภาพคู่ร่วมธุรกิจเกินค่าที่กำหนดช่วงหัวใจคลายเกิน 90,1,ตรวจสอบพบเอกสาร se-f-0277 rev 006 พบการตรวจสอบสุขภาพคู่ร่วมธุรกิจเกินค่าที่กำหนดช่วงหัวใจคลายเกิน 90,"Check found document se-f-0277 rev 006 found business partner's health check exceeded the specified value, heart rate exceeded 90."
2996,PP3,Unknown,Unknown,Unsafe Condition,Unknown,ตรวจสอบพื้นที่ PP#3 บริเวณลานหิน ข้างอาคารตัดเม็ด พบกระป๋องสี และกองใบเลื่อยไฟฟ้า วางอยู่ อาจจะได้รับอันตรายจากการเดินเหยียบใบเลื่อยได้,1,"ตรวจสอบพื้นที่ pp#3 บริเวณลานหิน ข้างอาคารตัดเม็ด พบกระป๋องสี , กองใบเลื่อยไฟฟ้า วางอยู่ อาจจะได้รับอันตรายจากการเดินเหยียบใบเลื่อยได้","Check the area pp#3 at the rocky yard next to the building. Found a can of paint, a pile of electric saw blades lying around. It may be dangerous from stepping on the saw blade."
2497,HOT,H-100B,RNC,Unsafe Condition,Hot Work,มีเศษวัสดุติดไฟอยู่ใกล้เคียงจุดปฏิบัติงาน,10,มีเศษวัสดุติดไฟอยู่ใกล้เคียงจุดปฏิบัติงาน,There is flammable material near the work site.
3648,Truck scale Site7,Unknown,Unknown,Unsafe Condition,Unknown,พบท่อสายไฟผุกร่อน จนมองเห็นสายไฟ ณ จุด Fire Alarm อันตรายอาจมีไฟฟ้ารั่วไหลได้ เมื่อโดนน้ำฝน,1,พบท่อสายไฟผุกร่อน จนมองเห็นสายไฟ ณ จุด fire alarm อันตรายอาจมีไฟฟ้ารั่วไหลได้ เมื่อโดนน้ำฝน,"Found a corroded electrical conduit. Until you can see the wires at the fire alarm point, there may be an electric leak. when hit by rain"
2634,HOT,H-100E,RNC,Unsafe Condition,Work at height,Hook Safety Harness ชำรุด,1,hook safety harness ชำรุด,broken hook safety harness
2946,HDPE2,Unknown,Unknown,Unsafe Condition,Unknown,พบ Safety lead ใช้สายคล้องคอห้อยบัตร ซึ่งไม่ถูกต้องตามข้อกำหนด,1,พบ safety lead ใช้สายคล้องคอห้อยบัตร ซึ่งไม่ถูกต้องตามข้อกำหนด,"Found a safety lead, used a neck strap to hang the card. which is not in accordance with the requirements"
3558,HDPE3,Unknown,Unknown,Unsafe Action,Unknown,พบการลงรายละเอียด ข้อ.14 และ -ข้อ.15 ไม่ถูกต้อง,1,"พบการลงรายละเอียด ข้อ.14 , -ข้อ.15 ไม่ถูกต้อง","Found detailing Item No. 14, - Item No. 15 incorrect."
2948,Store Site7,Unknown,Unknown,Unsafe Action,Unknown,มีการทำงานบดอัดดินด้วยเครื่องตบดิน แต่ไม่ได้ระบุลักษณะงาน และเครื่องมือที่ใช้ บนwork permit,1,"มีการทำงานบดอัดดินด้วยเครื่องตบดิน แต่ไม่ได้ระบุลักษณะงาน , เครื่องมือที่ใช้ บนwork permit","There is work to compact the soil with a soil compaction machine. but does not specify the nature of work, tools used on the work permit"
2949,Bagging Site7,Unknown,Unknown,Unsafe Condition,Unknown,เจ้าของพื้นที่ไม่ลงชื่อปิด work permit เมื่องานเสร็จสิ้น,1,เจ้าของพื้นที่ไม่ลงชื่อปิด work permit เมื่องานเสร็จสิ้น,The owner of the area does not sign off the work permit when the work is completed.
2811,PP3,Unknown,Unknown,Unsafe Condition,Unknown,มีการทำงานบนที่สูง แต่ผู้ขออนุญาตไม่ได้ตรวจสอบมาตรการความปลอดภัยในแบบฟอร์มตรวจสอบการป้องกันการตกจากที่สูง (SE-F-0286) ซึ่งผิดมาตรฐาน SE-O-0025 Rev.005_มาตรฐานความปลอดภัยในการปฏิบัติงานบนที่สูง (Working at Height),2,มีการทำงานบนที่สูง แต่ผู้ขออนุญาตไม่ได้ตรวจสอบมาตรการความปลอดภัยในแบบฟอร์มตรวจสอบการป้องกันการตกจากที่สูง (se-f-0286) ซึ่งผิดมาตรฐาน se-o-0025 rev.005_มาตรฐานความปลอดภัยในการปฏิบัติงานบนที่สูง (working at height),"working at height But the applicant did not check the safety measures in the fall protection inspection form (se-f-0286), which is in violation of the standard se-o-0025 rev.005_Safety Standards for Workplace Operations. high (working at height)"
1370,COLD,E-505A,JS Tech,Unsafe Condition,Housekeeping,วาง Tube ไว้โดยไม่ได้ปิดล้อมพื้นที่,1,วาง tube ไว้โดยไม่ได้ปิดล้อมพื้นที่,Place the tube without enclosing the area.
2954,Ware house Site7,Unknown,Unknown,Unsafe Action,Unknown,ป้ายbraricateไม่ได้ตามมาตรฐาน ,1,ป้ายbraricateไม่ได้ตามมาตรฐาน,The braricate sign is not up to the standard.
2079,ARU,R-800,WTM,Unsafe Action,Insulation,งาน Insulation ใช้ถุงมือกันบาดไม่ตรงตามที่ระบุใน JSA,6,งาน insulation ใช้ถุงมือกันบาดไม่ตรงตามที่ระบุใน jsa,"Insulation work, use cut resistant gloves not as specified in jsa."
3724,Catalyst&Pilot plant,Unknown,Unknown,Unsafe Action,Unknown,ตรวจสอบพบ MASK ที่ใช้งาน หมดอายุ (ตามรูปแนบ) ปี 2015 MASK มีอายุ 7 ปี (MASK หมดอายุการใช้งาน 5 ปี และสภาพชำรุด),1,"ตรวจสอบพบ mask ที่ใช้งาน หมดอายุ (ตามรูปแนบ) ปี 2015 mask มีอายุ 7 ปี (mask หมดอายุการใช้งาน 5 ปี , สภาพชำรุด)","Inspected and found a mask that is used, expired (as shown in the attached picture), year 2015, the mask is 7 years old (mask expires 5 years, damaged condition)"
2961,HDPE1,Unknown,Unknown,Unsafe Condition,Unknown,มีการลงช่องและเซนต์ชื่อ การประเมินพื้นที่ความปลอดภัยที่หน้างาน ก่อนที่จะมีการขอเปิด Work จากเจ้าของพื้นที่,1,"มีการลงช่อง, เซนต์ชื่อ การประเมินพื้นที่ความปลอดภัยที่หน้างาน ก่อนที่จะมีการขอเปิด work จากเจ้าของพื้นที่","There is a box, name sign, safety area assessment at the site. Before there is a request to open work from the owner of the area"
730,UT,P-S2400C,REPCO (IE),Unsafe Action,LOTO/ LB,ไม่ได้แขวน Tag ที่ Switch,1,ไม่ได้แขวน tag ที่ switch,Didn't hang tag on switch
3111,PP1,Unknown,Unknown,Unsafe Action,Unknown,ตรวจสอบพบเอกสาร Safe Work Certificate งานยก พบไม่มีการคำนวณในเอกสารให้ครบถ้วน(มีการปฏิบัติงานแล้ว),23,ตรวจสอบพบเอกสาร safe work certificate งานยก พบไม่มีการคำนวณในเอกสารให้ครบถ้วน(มีการปฏิบัติงานแล้ว),"Check for safe work certificate documents, lifting work found that there is no calculation in the complete documents (work has been done)"
1051,HOT,H-100B,RNC,Unsafe Action,Work at height,ขึ้นทำงานบนนั่งร้านที่มีสภาพไม่พร้อมใช้งาน และไม่มี Tag แดงแขวน,12,"ขึ้นทำงานบนนั่งร้านที่มีสภาพไม่พร้อมใช้งาน , ไม่มี tag แดงแขวน","Working on the scaffolding that is not ready to use, no red tag hanging"
2967,Bagging Site3,Unknown,Unknown,Unsafe Condition,Unknown,พบผ่านไม้กระดานที่ปลูกเพื่อขึ้นทำงานไม่มีการบวกหลักด้วยเชือกหรือลวด,1,"พบผ่านไม้กระดานที่ปลูก, ขึ้นทำงานไม่มีการบวกหลักด้วยเชือกหรือลวด","Found through a planted plank, no more work plus a core with rope or wire."
2968,HDPE4,Unknown,Unknown,Unsafe Action,Unknown,ผู้ขออนุญาตลืมเช็คพิกัดที่จะยกในส่วนที่ 1,1,ผู้ขออนุญาตลืมเช็คพิกัดที่จะยกในส่วนที่ 1,The applicant forgot to check the coordinates to be lifted in Part 1.
2417,UT,PIT-3060,Clear Engineering,Unsafe Action,Work at height,"เครื่องมือและอุปกรณ์ (ประแจ, ค้อน) ที่นำมาใช้งาน ไม่มีเชือกผูกมัดสำหรับป้องกันการตก",6,"เครื่องมือ, อุปกรณ์ (ประแจ , ค้อน) ที่นำมาใช้งาน ไม่มีเชือกผูกมัดสำหรับป้องกันการตก","Tools, equipment (wrench, hammer) used No binding rope for fall protection"
1322,UT,Boiler B,MOC (OPE),Unsafe Condition,Others,"แผ่นรางระบายน้ำวางเกยระดับกัน
",1,"แผ่นรางระบายน้ำวางเกยระดับกัน,","Drainage slabs are stacked on top of each other,"
1755,ARU,"D-962
",MOC (OPE),Unsafe Condition,Housekeeping,"รถซาเล้งมีสภาพชำรุด ไม่พร้อมใช้งานและไม่ได้จัดเก็บ 5 ส. 
",1,"รถซาเล้งมีสภาพชำรุด ไม่พร้อมใช้งาน, ไม่ได้จัดเก็บ 5 ส.,","The saleng car is damaged. not available, not stored 5 Sat,"
1878,Olefins2,P2,TTCL,Unsafe Condition,Scaffolding,ติดตั้งนั่งร้านกีดขวางอุปกรณ์ Plant,126,ติดตั้งนั่งร้านกีดขวางอุปกรณ์ plant,Install scaffolding to block plant equipment
481,HOT,H-100E,RNC,Unsafe Action,Insulation,ทำงานหุ้ม insulation บนนั่งร้านคนเดียว ,20,ทำงานหุ้ม insulation บนนั่งร้านคนเดียว,Working on insulation on scaffolding alone
3606,HDPE2,Unknown,Unknown,Unsafe Action,Unknown,ตรวจพบบันไดที่นำมาใช้งานไม่ผ่านการตรวจสภาพ,3,ตรวจพบบันไดที่นำมาใช้งานไม่ผ่านการตรวจสภาพ,Found that the ladder used did not pass the inspection.
3660,PP1,Unknown,Unknown,Unsafe Action,Unknown,"พบเอกสาร SWC WAH ทาง SAFETY LEAD , PERMIT REQUESTOR ลงชื่อรับรองก่อนรวจสอบมาตรการ WAH",2,"พบเอกสาร swc wah ทาง safety lead , permit requestor ลงชื่อรับรองก่อนรวจสอบมาตรการ wah","found document swc wah via safety lead, permit requestor sign and certify before inspecting wah measures"
3664,PP1,Unknown,Unknown,Unsafe Condition,Unknown,ตรวจสอบพบการผูกมัดอุปกรณ์ Monorail มีน้ำหนักการมัดด้วย Sling มีการบิดตัว (ตามรูป) จุดบิดตัวจะเป็นจุดรับหนักมากอาจจะทำให้ Sling เสียหายและอาจจะทำให้ขาดได้,1,"ตรวจสอบพบการผูกมัดอุปกรณ์ monorail มีน้ำหนักการมัดด้วย sling มีการบิดตัว (ตามรูป) จุดบิดตัวจะเป็นจุดรับหนักมากอาจจะทำให้ sling เสียหาย, อาจจะทำให้ขาดได้","Check that the monorail device is tied with a weight, the sling is twisted (as in the picture), the twisting point will be a very heavy point, which may cause the sling to be damaged, possibly causing it to break."
1323,Olefins2,PR-21,PSA,Unsafe Action,Work Procedure,ใช้ไฟฟ้าจากตู้ Panel OSBL เพื่อทำงานตัด เชื่อม เจียร Safety Guard ด้านใน ISBL ,1,"ใช้ไฟฟ้าจากตู้ panel osbl , ทำงานตัด เชื่อม เจียร safety guard ด้านใน isbl","Use electricity from panel osbl cabinet, work on cutting, welding, grinding safety guard inside isbl"
1208,TFU,Interpipe,ACE,Unsafe Condition,Work at height,ไม่มีเชือกคล้องเกี่ยวอุปกรณ์ที่ใช้งาน,10,ไม่มีเชือกคล้องเกี่ยวอุปกรณ์ที่ใช้งาน,There is no rope attached to the device in use.
569,ARU,-,REPCO (MES),Unsafe Action,Paint/ Coat/ Blast,ใช้ถังดับเพลิง plant stand by งานขัดสนิมทาสี,1,ใช้ถังดับเพลิง plant stand by งานขัดสนิมทาสี,Use a fire extinguisher plant stand by rust polishing work
1326,UT,PR-7B,TTCL,Unsafe Condition,Hot Work,มีการทำงาน Hot work class l บน Pipe rack 7 B ซึ่งบริเวณนั้นมีหญ้าแห้ง อยู่จึงกลัวว่าจะเกิดไฟไหม้ได้,1,มีการทำงาน hot work class l บน pipe rack 7 b ซึ่งบริเวณนั้นมีหญ้าแห้ง อยู่จึงกลัวว่าจะเกิดไฟไหม้ได้,There was a hot work class l on pipe rack 7 b where there was dry grass. So afraid that there will be a fire
1744,Olefins2,PR-17,TTCL,Unsafe Condition,Housekeeping,สายไฟวางพาด กีดขวางทางเดิน,13,สายไฟวางพาด กีดขวางทางเดิน,Power lines laying across the road obstructing the path.
1639,Olefins2,P1,TTCL/ RSC,Unsafe Condition,Scaffolding,ใช้รถเข็นน้ำขนย้ายอุปกรณ์นั่งร้าน,51,ใช้รถเข็นน้ำขนย้ายอุปกรณ์นั่งร้าน,Use water carts to transport scaffolding equipment.
1031,HOT,H-100G,RNC,Unsafe Condition,Installation/ Alignment,Lock U-bolt ชั้นเดียว งาน Re-tube TLE (lesson learned tube รูดระหว่างทำงาน),3,lock u-bolt ชั้นเดียว งาน re-tube tle (lesson learned tube รูดระหว่างทำงาน),single layer lock u-bolt re-tube tle work (lesson learned tube swipe during work)
370,TFU,Naptha Tank,MOC (SD),Unsafe Condition,Housekeeping,"Waste, Slag รอการจัดเก็บและขนย้ายออกจากพื้นที่",3,"waste , slag รอการจัดเก็บ, ขนย้ายออกจากพื้นที่","waste , slag waiting for storage , moving out of the area"
2448,HOT,H-100E,RNC,Unsafe Action,Tools & Equipment,นำ Cutter แบบธรรมดาเข้ามาใช้งาน Insulation,1,นำ cutter แบบธรรมดาเข้ามาใช้งาน insulation,Bring a simple cutter to use for insulation.
498,HOT,PSV-9309AB,LEO,Unsafe Action,PPE,งาน Remove/ Install PSV ไม่สวมใส่ถุงมือ,3,"งาน remove, install psv ไม่สวมใส่ถุงมือ","The remove, install psv task does not wear gloves."
610,HOT,H-100G,RNC,Unsafe Action,Work at height,คล้องเกี่ยว Safety Harness กับอุปกรณ์ Plant,9,"คล้องเกี่ยว safety harness , อุปกรณ์ plant","safety harness , plant equipment"
1335,UT,PIT-3060,HDS,Unsafe Condition,Chemical Work,ฝนตกแล้วโดนแท่งคอนกรีต ( วางรอกำจัด ) อาจทำให้ฝนที่ตกชะล้างสารปนเปื้อน(Waste)หรือคาบ Oil ที่อยู่กับแท่งคอนกรีตไหลลงรางระบายน้ำได้,1,"ฝนตกแล้วโดนแท่งคอนกรีต ( วางรอกำจัด ) อาจทำให้ฝนที่ตกชะล้างสารปนเปื้อน(waste)หรือคาบ oil ที่อยู่, แท่งคอนกรีตไหลลงรางระบายน้ำได้","When it rains and hits the concrete (laying awaiting removal), it may cause the rain to wash away the contaminants (waste) or the oil layer, the concrete can flow down the drain."
2083,Olefins2,C-S300,RSC,Unsafe Condition,Housekeeping,อุปรณ์นั่งร้านวางกีดขวางทางเดิน,172,อุปรณ์นั่งร้านวางกีดขวางทางเดิน,Scaffolding equipment obstructing the walkway
1118,HOT,H-100G,RNC,Unsafe Condition,Lifting,จำนวน Pipe ที่ใช้ต๋งอุปกรณ์รับน้ำหนักไม่เหมาะสมทำให้ Grating ยุบ,6,จำนวน pipe ที่ใช้ต๋งอุปกรณ์รับน้ำหนักไม่เหมาะสมทำให้ grating ยุบ,"The number of pipes used to support the weight is not suitable, causing the grating to collapse."
1341,TFU,TK-1010B,TOTAL FLOW,Unsafe Condition,Housekeeping,ไม่จัดเก็บ 5 ส.หลังจบงาน,1,ไม่จัดเก็บ 5 ส.หลังจบงาน,Do not collect 5 S. after work
1342,TFU,TK-1010B,-,Unsafe Condition,Housekeeping,พบลูกโป่งจากงานวันลอยกระทง,1,พบลูกโป่งจากงานวันลอยกระทง,Found balloons from the Loi Krathong festival.
583,HOT,H-100A,RNC,Unsafe Action,Scaffolding,ผู้ปฏิบัติงานยืนเหยียบบน Line pipe เพื่อรับส่งอุปกรณ์นั่งร้าน,4,"ผู้ปฏิบัติงานยืนเหยียบบน line pipe , รับส่งอุปกรณ์นั่งร้าน","Operators stand on line pipes, pick up scaffolding equipment."
1360,Olefins2,-,TTCL,Unsafe Action,Work Procedure,ผู้หญิงขึ้นนั่งร้าน  เกิน  10  เมตร,2,ผู้หญิงขึ้นนั่งร้าน เกิน 10 เมตร,Women ride on scaffolding more than 10 meters
1349,HOT,H-100E,RNC,Unsafe Condition,Housekeeping,ผ้าใบกันแดดไม่ได้ใช้งาน มีน้ำขัง,1,ผ้าใบกันแดดไม่ได้ใช้งาน มีน้ำขัง,"The sun visor is not used, it is waterlogged."
1351,TFU,ZZ-1010A,KEC,Near Miss,Chemical Work,Carbon มีความร้อนสะสมขณะ Load Carbon,1,carbon มีความร้อนสะสมขณะ load carbon,carbon has heat accumulation while loading carbon
1352,UT,C-2400I,REPCO (MES),Unsafe Action,PTW & JSA,ไม่มี WP stand by ที่หน้างาน (concern เรื่องการตรวจสอบ WP ไม่เป็นไปตามหน้างานจริง),1,ไม่มี wp stand by ที่หน้างาน (concern เรื่องการตรวจสอบ wp ไม่เป็นไปตามหน้างานจริง),There is no wp stand by at the job site (concern about checking wp is not in accordance with the actual job site)
1354,HOT,DMDS,Taratorn M.,Unsafe Condition,Housekeeping,"คราบสนิมบนพื้น, ไม่ได้จัดเก็บ Barricade",1,"คราบสนิมบนพื้น , ไม่ได้จัดเก็บ barricade","Rust stains on the floor, barricade not stored"
