FindingNo,Area,SubArea,Contractor,TypeOfFinding,Topic,Details,Frequency,CleansingDetails,TranslateDetails
3188,HDPE4,Unknown,Unknown,Unsafe Action,Unknown,ใช้เครื่องมือไม่ตรงตามที่ระบุ,1,ใช้เครื่องมือไม่ตรงตามที่ระบุ,Using tools that are not specified
3218,PP1,Unknown,Unknown,Unsafe Action,Unknown,"ตรวจสอบ Work Permit พบ 
หัวข้อ 1.2 (จำนวนคนทำงาน)และ
หัวข้อ 1.3 (ไม่ลงชื่อ Safety Lead)",20,"ตรวจสอบ work permit พบ , หัวข้อ 1.2 (จำนวนคนทำงาน), , หัวข้อ 1.3 (ไม่ลงชื่อ safety lead)","Check the work permit found, Section 1.2 (number of people working), Section 1.3 (no safety lead sign)"
3190,Catalyst&Pilot plant,Unknown,Unknown,Unsafe Action,Unknown,ผู้ขออนุญาติยังไม่มีความ พร้อมและเข้าใจระบบ LOTO/LB,1,"ผู้ขออนุญาติยังไม่มีความ พร้อม, เข้าใจระบบ loto, lb","The applicant is not ready, understand the loto system, lb"
3193,HDPE1,Unknown,Unknown,Unsafe Action,Unknown,Safety Lead ไม่ลงชื่อในใบขออนุญาติทำงาน,29,safety lead ไม่ลงชื่อในใบขออนุญาติทำงาน,safety lead does not sign the work permit application
3181,PP3,Unknown,Unknown,Unsafe Action,Unknown,"ผู้ปฏิบัติงานไม่ได้ลงชื่อรับทราบมาตรการความปลอดภัยใน JSA แต่ได้ทำงานไปแล้ว
",43,"ผู้ปฏิบัติงานไม่ได้ลงชื่อรับทราบมาตรการความปลอดภัยใน jsa แต่ได้ทำงานไปแล้ว,","The worker has not signed a safety measure in jsa but has done the job,"
2776,Bagging Site1,Unknown,Unknown,Unsafe Condition,Unknown,มีคราบน้ำมันบนพื้นทางเดิน,1,มีคราบน้ำมันบนพื้นทางเดิน,There was an oil stain on the floor of the corridor.
3197,PP1,Unknown,Unknown,Unsafe Condition,Unknown,"ฝาครอบรางระบายน้ำที่เป็นแบบตะแกรงเหล็ก ปิดไม่เต็มพื้นที่มีช่องกว้าง และตัวตะแกรงมีช่องที่กว้างที่ล้อจักรยานจะตกลงไปได้
",1,"ฝาครอบรางระบายน้ำที่เป็นแบบตะแกรงเหล็ก ปิดไม่เต็มพื้นที่มีช่องกว้าง , ตัวตะแกรงมีช่องที่กว้างที่ล้อจักรยานจะตกลงไปได้,","Drain cover that is a steel grate. not fully closed, the area has a wide hole, the grille has a wide hole where the bicycle wheel can fall,"
3198,PP1,Unknown,Unknown,Near Miss,Unknown,กระจกตรงประตูเข้าห้อง GC Analyzer แตกเป็นรู,1,กระจกตรงประตูเข้าห้อง gc analyzer แตกเป็นรู,The glass at the door to the gc analyzer room was shattered.
788,Olefins2,PR-15,MOC (Safety),Unsafe Condition,Others,Wind sock ขาดชำรุด,3,wind sock ขาดชำรุด,broken wind sock
3201,HDPE3,Unknown,Unknown,Unsafe Action,Unknown,พบมีการนำลวดมาผูกยึดในส่วนของเเบรคแทนสลิง  ซึ่งผิดจากที่กำหนดไว้,1,พบมีการนำลวดมาผูกยึดในส่วนของเเบรคแทนสลิง ซึ่งผิดจากที่กำหนดไว้,It was found that the wire was attached to the brake part instead of the sling. which is different from the specified
3102,CPD Pipe Site3,Unknown,Unknown,Unsafe Action,Unknown,พบเอกสารเป็น Rev.เก่า,8,พบเอกสารเป็น rev.เก่า,The document is found as an old rev.
2965,Bagging Site3,Unknown,Unknown,Unsafe Action,Unknown,พบ Safety harness ที่นำมาใช้งานไม่มีสติ๊กเกอร์ผ่านการตรวจสภาพ และ สภาพไม่พร้อมใช้งาน,12,"พบ safety harness ที่นำมาใช้งานไม่มีสติ๊กเกอร์ผ่านการตรวจสภาพ , สภาพไม่พร้อมใช้งาน","The safety harness was found to be used without a sticker that passed the inspection, the condition is not ready for use."
894,Olefins2,H-S120A,KEC,Unsafe Action,Lifting,งานยก/ขนย้ายอุปกรณ์ ใช้สะเก็นที่ไม่มี Tag inspect ,3,"งานยก, ขนย้ายอุปกรณ์ ใช้สะเก็นที่ไม่มี tag inspect","Lifting work, moving equipment Use a shackle without a tag inspect."
3207,Catalyst&Pilot plant,Unknown,Unknown,Unsafe Action,Unknown,ไม่พบการลงบันทึกการรับทราบระหว่างกะทำงาน ของหัวหน้างาน (operation lock ) กุญแจนำ้เงิน,1,ไม่พบการลงบันทึกการรับทราบระหว่างกะทำงาน ของหัวหน้างาน (operation lock ) กุญแจนำ้เงิน,Acknowledgment logs were not found during the work shift. of supervisors (operation lock) money key
3209,Catalyst&Pilot plant,Unknown,Unknown,Unsafe Condition,Unknown,ทราบว่าต้องวางแผนการคำนวณน้ำหนักแต่ไม่ปฎิบัติ,1,ทราบว่าต้องวางแผนการคำนวณน้ำหนักแต่ไม่ปฎิบัติ,"Know that you need to plan the weight calculation, but do not practice."
3210,Catalyst&Pilot plant,Unknown,Unknown,Unsafe Condition,Unknown,มีการนำทินเนอร์ใส่ภาชนะที่เป้นขวดน้ำดื่มเข้ามาใช้งาน,1,มีการนำทินเนอร์ใส่ภาชนะที่เป้นขวดน้ำดื่มเข้ามาใช้งาน,Thinners are brought into containers that are similar to drinking water bottles.
3174,HDPE2,Unknown,Unknown,Unsafe Action,Unknown,ตรวจสอบเอกสารเรียบร้อย แต่ผู้ให้สัญญาณไม่สวมใส่เสื้อสะท้อนแสงตามมาตรการกำหนด,9,ตรวจสอบเอกสารเรียบร้อย แต่ผู้ให้สัญญาณไม่สวมใส่เสื้อสะท้อนแสงตามมาตรการกำหนด,check the document But signal providers do not wear reflective vests as required by the measures.
3306,Bagging Site7,Unknown,Unknown,Near Miss,Unknown,ตรวจพบเครื่องวัดความดันโลหิต Calibration หมดอายุแล้ว ,1,ตรวจพบเครื่องวัดความดันโลหิต calibration หมดอายุแล้ว,Blood pressure monitor detected. Calibration has expired.
241,TFU,Truck Load,PROTECH,Unsafe Action,PTW & JSA,Modify นั่งร้านโดยไม่มี Work Permit,36,modify นั่งร้านโดยไม่มี work permit,modify scaffolding without work permit
2718,PP2,Unknown,Unknown,Unsafe Action,Unknown,ตรวจสอบเอกสาร Safe Work Certificate SE-F-0286_REV.003 พบขาดการตรวจสอบ โดย Safety Lead และ Permit Requestor,39,"ตรวจสอบเอกสาร safe work certificate se-f-0286_rev.003 พบขาดการตรวจสอบ โดย safety lead , permit requestor","Check document safe work certificate se-f-0286_rev.003 Lack of inspection by safety lead, permit requestor"
3319,HDPE1,Unknown,Unknown,Unsafe Action,Unknown,ตรวจสอบเอกสาร Work Permit เซ็นเอกสารมาตราการไม่ครบตามเวลา ทุกๆ 4 ชั่วโมง,17,ตรวจสอบเอกสาร work permit เซ็นเอกสารมาตราการไม่ครบตามเวลา ทุกๆ 4 ชั่วโมง,"Check the work permit document, sign the document, the measures are not complete on time, every 4 hours."
3691,LLDPE,Unknown,Unknown,Unsafe Action,Unknown,ประเมิน jsaไม่ครอบคลุม,17,ประเมิน jsaไม่ครอบคลุม,Evaluate jsa is not comprehensive.
3315,PP2,Unknown,Unknown,Unsafe Action,Unknown,ไม่ตรงตามลักษณะงานที่ขอไว้,1,ไม่ตรงตามลักษณะงานที่ขอไว้,does not correspond to the nature of the job requested
3320,HDPE1,Unknown,Unknown,Unsafe Action,Unknown,ตรวจสอบเอกสาร Safe Work Certificate SE-F-0337Rev.000 หัวข้อ 13 กรณี Jet แบบแส้ หรือ Tube ต้องมีการจัดทำ Warning tape พบมีการทำถูกต้องแต่ลงเอกสารว่าไม่เกี่ยวข้อง,1,ตรวจสอบเอกสาร safe work certificate se-f-0337rev.000 หัวข้อ 13 กรณี jet แบบแส้ หรือ tube ต้องมีการจัดทำ warning tape พบมีการทำถูกต้องแต่ลงเอกสารว่าไม่เกี่ยวข้อง,"Examine safe work certificate document se-f-0337rev.000 Item 13 In case of a whip or tube jet, a warning tape must be produced."
2376,HOT,GTG,WTM,Unsafe Condition,Scaffolding,ติดตั้งนั่งร้าน ไม่ปิดล้อมพื้นที่,126,ติดตั้งนั่งร้าน ไม่ปิดล้อมพื้นที่,install scaffolding not enclosed area
2843,PP3,Unknown,Unknown,Unsafe Action,Unknown,WAH Certificate มีการใช้แต่ระบุข้อมูลไม่ครบ ผู้ขออนุญาติ safety lead แจ้งว่าลืม,5,wah certificate มีการใช้แต่ระบุข้อมูลไม่ครบ ผู้ขออนุญาติ safety lead แจ้งว่าลืม,wah certificate used but not complete
896,HOT,H-100B,RNC,Unsafe Condition,Lifting,ใช้สลิงผ้าใบที่มีขนาดสั้นต๋ง Pipe ทำให้ปลายสลิงผ้าใบอีกด้านคล้องไม่ถึงตะขอ,20,ใช้สลิงผ้าใบที่มีขนาดสั้นต๋ง pipe ทำให้ปลายสลิงผ้าใบอีกด้านคล้องไม่ถึงตะขอ,Use a short pipe sling to make the other end of the canvas sling not reach the hook.
2701,PP2,Unknown,Unknown,Near Miss,Unknown,งานประกอบหน้าแปลนผู้ปฏิบัติงานอยู่ในตำแหน่ง line of fire ถ้าค้อนหลุดมือจะโดนผู้ปฏิบัติงานที่อยู่ด้านตรงข้ามได้,1,งานประกอบหน้าแปลนผู้ปฏิบัติงานอยู่ในตำแหน่ง line of fire ถ้าค้อนหลุดมือจะโดนผู้ปฏิบัติงานที่อยู่ด้านตรงข้ามได้,"In flange assembly work, the worker is in line of fire position. If the hammer slips, it will hit the worker on the opposite side."
2915,HDPE1,Unknown,Unknown,Unsafe Action,Unknown,ตรวจสอบพบถังดำเพลิงไม่พร้อมใช้งาน สถานะ Recharge ,1,ตรวจสอบพบถังดำเพลิงไม่พร้อมใช้งาน สถานะ recharge,Checked that the black tank is not available. Recharge status.
1396,ARU,F-800,MOC (OPE),Unsafe Action,LOTO/ LB,งาน Clean Filter ไม่มี Tag LOTO,1,งาน clean filter ไม่มี tag loto,"clean filter job, no tag loto"
3327,Catalyst&Pilot plant,Unknown,Unknown,Unsafe Condition,Unknown,"ตรวจสอบ JSA พบมีการตรวจสอบมาตราการครบ
ส่วนผู้ปฏิบัติงานไม่ปฏิบัติตามที่ JSA กำหนดไว้ ทำงานปูนต้องสวมใส่ถุงมือยาง (ผู้ปฏิบัติงานไม่สวมใส่ถุงมือยาง)",1,"ตรวจสอบ jsa พบมีการตรวจสอบมาตราการครบ, ส่วนผู้ปฏิบัติงานไม่ปฏิบัติตามที่ jsa กำหนดไว้ ทำงานปูนต้องสวมใส่ถุงมือยาง (ผู้ปฏิบัติงานไม่สวมใส่ถุงมือยาง)","Examine jsa, found that there is a full inspection, while the operator does not comply with the jsa specified. Working with cement must wear rubber gloves. (operators do not wear rubber gloves)"
1456,UT,Clarify,ATP,Unsafe Action,PTW & JSA,แนบ JSA ไม่ตรงกับกับงานที่ปฏิบัติ (งานยิงกล้องวัดระดับ),6,"แนบ jsa ไม่ตรง, , งานที่ปฏิบัติ (งานยิงกล้องวัดระดับ)","jsa attachment doesn't match, , executable (Camera shooting work)"
3394,PP1,Unknown,Unknown,Unsafe Action,Unknown,ตรวจสอบพบ JSA ขาดการประเมินความเสี่ยงในงานการทำงานบนที่สูง,27,ตรวจสอบพบ jsa ขาดการประเมินความเสี่ยงในงานการทำงานบนที่สูง,JSA found a lack of risk assessment in work at height.
2711,HDPE3,Unknown,Unknown,Unsafe Action,Unknown,"ตรวจพบสเก็นที่ใช้งานกับสลิงกระเช้ายกของ ยังไม่ผ่านการตรวจสภาพ
 ( Tag ยังเป็นของเดือนมีนาคม-สีเขียว )",2,"ตรวจพบสเก็นที่ใช้งาน, สลิงกระเช้ายกของ ยังไม่ผ่านการตรวจสภาพ, ( tag ยังเป็นของเดือนมีนาคม-สีเขียว )","Detects active shackles, lifting slings. Haven't passed the condition check, ( tag still belongs to march-green )"
3451,Catalyst&Pilot plant,Unknown,Unknown,Unsafe Action,Unknown,ตรวจสอบพบการปฏิบัติงาน ใช้ฆ้อนแบบเหล็ก มาใช้งาน ,1,ตรวจสอบพบการปฏิบัติงาน ใช้ฆ้อนแบบเหล็ก มาใช้งาน,check found operation Use an iron hammer to use.
1837,HOT,H-100A,REPCO (MES),Unsafe Action,PTW & JSA,การระบุรายละเอียดของงานใน Work permit ไม่ครอบคลุมงานที่ปฏิบัติรวมถึง JSA ที่แนบ W/P มาด้วย (มีการทำงาน 2 จุดและแตกต่างตามลักษณะงาน),36,"การระบุรายละเอียดของงานใน work permit ไม่ครอบคลุมงานที่ปฏิบัติรวมถึง jsa ที่แนบ w, p มาด้วย (มีการทำงาน 2 จุด, แตกต่างตามลักษณะงาน)","Specifying the job description in the work permit does not cover the work performed including jsa attached w, p (there are 2 points of work, differing according to the nature of work)"
3561,HDPE3,Unknown,Unknown,Unsafe Action,Unknown,พบไม่มีการตรวจสอบมาตรการหน้างาน,7,พบไม่มีการตรวจสอบมาตรการหน้างาน,It was found that there was no inspection of measures on site.
3420,LLDPE,Unknown,Unknown,Unsafe Action,Unknown,ตรวจสอบพบ JSA ไม่ตรงกับงานที่ปฏิบัติ,10,"ตรวจสอบพบ jsa ไม่ตรง, งานที่ปฏิบัติ","Checked for jsa mismatch, executed task."
3457,HDPE4,Unknown,Unknown,Unsafe Condition,Unknown,ตรวจสอบพบ ถังรองน้ำมันใต้ Dryer  มีน้ำมันล้นถังและมีน้ำผสม,1,"ตรวจสอบพบ ถังรองน้ำมันใต้ dryer มีน้ำมันล้นถัง, มีน้ำผสม","Check that the oil reservoir under the dryer is overflowing with oil, mixing water."
1738,HOT,H-100F,RNC,Unsafe Action,SL Performance,Safety Lead ลงชื่อไว้ใน Work permit แต่ไม่ได้อยู่ควบคุมที่หน้างาน,35,safety lead ลงชื่อไว้ใน work permit แต่ไม่ได้อยู่ควบคุมที่หน้างาน,The safety lead is signed on the work permit but is not supervised at the work site.
3684,PP3,Unknown,Unknown,Unsafe Action,Unknown,ไม่มีการปิดล้อมพื้นที่ ไม่มี barricade tag,14,ไม่มีการปิดล้อมพื้นที่ ไม่มี barricade tag,"No enclosed area, no barricade tag."
1716,Olefins2,PR-24,MYC,Unsafe Condition,Housekeeping,วางใบหินเจียรทิ้งไว้บนนั่งร้าน,3,วางใบหินเจียรทิ้งไว้บนนั่งร้าน,Place the grinding stone on the scaffolding.
913,HOT,H-100C,ATI-LT,Unsafe Action,PTW & JSA,"งานรื้อนั่งร้านและขนย้ายอุปกรณฺ์
*ในหน่วยงานซ่อมยังใช้ Workpermit เก่าอยู่และก็ได้แนะนำไปแล้ว",1,"งานรื้อนั่งร้าน, ขนย้ายอุปกรณฺ์, *ในหน่วยงานซ่อมยังใช้ workpermit เก่าอยู่, ก็ได้แนะนำไปแล้ว","Dismantling scaffolding, moving equipment, *In the repair agency still using the old workpermit, has already been recommended."
3389,PP1,Unknown,Unknown,Unsafe Condition,Unknown,ตรวจสอบพบงานถอด Control Valve พบการใช้ Sling ผ้า ยกโดยใช้ขนาดที่ยาวเกินไปและทำการผู้มัดเป็นปมและเป็นจุดที่รับแรงอาจจะทำไม้Slinf ผ้าเสียหายหรือขาดได้ อาจจะทำอันตรายต่อบุคคลที่กำลังปฏิบัติงานได้,1,"ตรวจสอบพบงานถอด control valve พบการใช้ sling ผ้า ยกโดยใช้ขนาดที่ยาวเกินไป, ทำการผู้มัดเป็นปม, เป็นจุดที่รับแรงอาจจะทำไม้slinf ผ้าเสียหายหรือขาดได้ อาจจะทำอันตรายต่อบุคคลที่กำลังปฏิบัติงานได้","Check found to remove the control valve. Found using a sling to lift it using a size that is too long, tie a knot, it is a point where the force may be made of a slinf. The fabric can be damaged or torn. May harm the person who is working."
3390,Ware house Site7,Unknown,Unknown,Unsafe Action,Unknown,Field Verifier ไม่ใช่โฟร์แมน รับรองความปลอดภัยที่หน้างาน HW class I,1,field verifier ไม่ใช่โฟร์แมน รับรองความปลอดภัยที่หน้างาน hw class i,field verifier not foreman Certification of safety at the event site hw class i
3391,PP2,Unknown,Unknown,Unsafe Condition,Unknown,ตรวจสอบพบรถ HIAB ทำการยกก้อนพลาสติกพบการกางขาเพื่อค้ำยัน Balance ตัวรถไม่กางขาครบทั้งข้าง อันตราย,1,"ตรวจสอบพบรถ hiab ทำการยกก้อนพลาสติกพบการกางขา, ค้ำยัน balance ตัวรถไม่กางขาครบทั้งข้าง อันตราย","Found a hiab car, lifted the plastic block, found the legs spread, braced the balance, the car did not spread the legs completely, dangerous."
2943,PP3,Unknown,Unknown,Unsafe Action,Unknown,เอกสารHealth check ยังเป็นฟอร์มเก่าไม่อัพเดท,2,เอกสารhealth check ยังเป็นฟอร์มเก่าไม่อัพเดท,"The health check document is still the old form, not updated."
2888,Bagging Site1,Unknown,Unknown,Unsafe Action,Unknown,"ตรวจสอบพบ Safe Work Certificate ยังไม่ Update 
- SE-F-0286 Rev.002 ที่สูง
- SE-f-0189 Rev.008 งาน H/W",45,"ตรวจสอบพบ safe work certificate ยังไม่ update , - se-f-0286 rev.002 ที่สูง, - se-f-0189 rev.008 งาน h, w","Detected safe work certificate not yet updated , - se-f-0286 rev.002 high, - se-f-0189 rev.008 work h, w"
2715,Catalyst&Pilot plant,Unknown,Unknown,Unsafe Action,Unknown,ตรวจสอบพบช่างเชื่อมขณะปฏิบัติงานเชื่อมไม่สวมใส่ MASK ป้องกันอันตรายจากฟูมงานเชื่อม (2097)ตามที่ JSA กำหนด,25,ตรวจสอบพบช่างเชื่อมขณะปฏิบัติงานเชื่อมไม่สวมใส่ mask ป้องกันอันตรายจากฟูมงานเชื่อม (2097)ตามที่ jsa กำหนด,Found that welders while working welding did not wear protective masks from welding fume (2097) as specified by jsa.
3397,Warehouse Site 3,Unknown,Unknown,Unsafe Action,Unknown,พบถังสีที่ใช้งานหมดแล้วไม่มีการจัดเก็บในภาชนะ และ ไม่มีป้ายบ่งชี้จุดจัดวาง,1,"พบถังสีที่ใช้งานหมดแล้วไม่มีการจัดเก็บในภาชนะ , ไม่มีป้ายบ่งชี้จุดจัดวาง","Found paint buckets that were used up, no storage in the container, no label indicating the placement point."
2506,UT,"UT, HOT, Olefins2",NALCO,Unsafe Action,Chemical Work,จัดทำ Dashboard monitoring ,1,จัดทำ dashboard monitoring,Provide dashboard monitoring
2507,Olefins2,T-S220,MOC (OPE),HNM,Process & Operation,Line Quench water leak มี Oil ปนเปื้อน (ZZ-S220),1,line quench water leak มี oil ปนเปื้อน (zz-s220),line quench water leak contaminated with oil (zz-s220)
2508,TFU,NEGF,REPCO (MES),Unsafe Condition,Work at height,พื้นที่รางระบายน้ำด้านข้าง High Flare พบดิน Slide ทรุดพังเป็นบริเวณกว้าง >> อยู่ระหว่างดำเนินการติดตั้ง Hard Barricade,1,พื้นที่รางระบายน้ำด้านข้าง high flare พบดิน slide ทรุดพังเป็นบริเวณกว้าง >> อยู่ระหว่างดำเนินการติดตั้ง hard barricade,The area of ??the high flare lateral drainage ditch found a wide area of ??soil slide collapsed >> Hard barricade installation is in progress.
2137,HOT,H-120R,REPCO (MES),Unsafe Action,Lifting,งานยกถุง Big Bag ข้ามอุปกรณ์ Plant ไม่มี Rigger,2,งานยกถุง big bag ข้ามอุปกรณ์ plant ไม่มี rigger,Big bag lifting work across plant equipment without rigger
