FindingNo,Area,SubArea,Contractor,TypeOfFinding,Topic,Details,Frequency,CleansingDetails,TranslateDetails
279,HOT,T-230,WTM,Unsafe Action,Work at height,เครื่องมือที่จะนำขึ้นไปใช้บนที่สูง ไม่มีเชือกผูกป้องกันการตก,2,เครื่องมือที่จะนำขึ้นไปใช้บนที่สูง ไม่มีเชือกผูกป้องกันการตก,tools to be used at high places No anti-fall rope
2592,HOT,FT-204,WTM,Unsafe Condition,Scaffolding,ไม่ได้ปิดกั้นพื้นที่ให้ครอบคลุมก่อนเริ่มปฏิบัติงาน,12,ไม่ได้ปิดกั้นพื้นที่ให้ครอบคลุมก่อนเริ่มปฏิบัติงาน,Do not block the area to cover before starting work.
68,UT,D-3042,Virat K.,Unsafe Condition,Housekeeping,ตาข่ายในบ่อ  ไม่ได้ใช้งาน ไม่มีการจัดเก็บ,1,ตาข่ายในบ่อ ไม่ได้ใช้งาน ไม่มีการจัดเก็บ,Pond net Not in use Not stored
134,UT,F-2400,WTM,Unsafe Action,PTW & JSA,เอกสารตัวหนังสือจาง ไม่ชัด,1,เอกสารตัวหนังสือจาง ไม่ชัด,Documents are faded and unclear.
1363,HOT,H-100B,REPCO (MES),Unsafe Action,PTW & JSA,Work permit ไม่ได้ระบุ JSA งานติดตั้งนั่งร้าน,49,work permit ไม่ได้ระบุ jsa งานติดตั้งนั่งร้าน,work permit does not specify jsa scaffolding installation work
2688,HDPE3,Unknown,Unknown,Unsafe Action,Unknown,พบสลิงผ้าใบสภาพชำรุด,3,พบสลิงผ้าใบสภาพชำรุด,A damaged canvas sling was found.
508,HOT,CFU,MOC (OPE),Unsafe Action,CSE,ระบุมาตรการการตรวจวัดแก๊สไว้ทุก 4 ชั่วโมง แต่ระบุการตรวจสอบหน้างานทุก 2 ชั่วโมง,6,ระบุมาตรการการตรวจวัดแก๊สไว้ทุก 4 ชั่วโมง แต่ระบุการตรวจสอบหน้างานทุก 2 ชั่วโมง,"Specify gas measurement measures every 4 hours, but specify on-site inspections every 2 hours."
2024,Olefins2,P2,PROTECH,Unsafe Action,PPE,งานขัดสนิมไม่สวมใส่หน้ากาก R95 ตามที่ระบุใน JSA,8,งานขัดสนิมไม่สวมใส่หน้ากาก r95 ตามที่ระบุใน jsa,Rust polishing work without mask r95 as specified in jsa
2065,TFU,Pipe Rack,TR,Unsafe Condition,Housekeeping,เศษขยะและอุปกรณ์นั่งร้านไม่ได้จัดเก็บ,131,"เศษขยะ, อุปกรณ์นั่งร้านไม่ได้จัดเก็บ","Garbage, scaffolding equipment is not stored."
1996,HOT,H-100B,RNC,Unsafe Action,Work at height,ไม่คล้องเกี่ยว Safety Harness,27,ไม่คล้องเกี่ยว safety harness,Not attached to safety harness
454,UT,PIT-3060,Virat K.,Unsafe Action,Hot Work,"เวลาประมาณ 11:20 น. พบ FV, Requestor ลงชื่อตรวจสอบหน้างาน/ ตรวจวัดแก๊สก่อนเริ่มงานช่วงบ่ายล่วงหน้า (13:30 น.)  >> เรียกมาตักเตือน",1,"เวลาประมาณ 11:20 น. พบ fv , requestor ลงชื่อตรวจสอบหน้างาน, ตรวจวัดแก๊สก่อนเริ่มงานช่วงบ่ายล่วงหน้า (13:30 น.) >> เรียกมาตักเตือน","At about 11:20 a.m., meet fv, requestor, sign up to inspect the site, measure gas before starting work in the afternoon (1:30 p.m.) >> call to warn"
1950,UT,TK-2710,NALCO,Unsafe Condition,Lifting,จอดรถคร่อมรางระบายน้ำและยกข้ามหัวรถ,1,"จอดรถคร่อมรางระบายน้ำ, ยกข้ามหัวรถ","Park the car across the drain, raise the car over the head."
2392,HOT,GT-5100,MOC (OPE),Unsafe Condition,Scaffolding,ทางขึ้นลงบันไดนั่งร้านไม่ Handrail กันตก,9,ทางขึ้นลงบันไดนั่งร้านไม่ handrail กันตก,The way up and down the scaffolding stairs does not have a handrail to prevent falls.
373,COLD,P-426A,WTM,Unsafe Action,Insulation,ไม่สวมใส่ถุงมือก่อนเริ่มปฏิบัติงาน,45,ไม่สวมใส่ถุงมือก่อนเริ่มปฏิบัติงาน,Do not wear gloves before starting work.
1698,HOT,H-100D,RNC,Unsafe Condition,Work at height,พบช่องเปิดที่ Transition piece Pass#2,1,พบช่องเปิดที่ transition piece pass#2,Found an opening at transition piece pass #2.
1946,UT,PIT-3060,HDS,Unsafe Action,Lifting,งานยกแผ่นคอนกรีตขึ้นจากบ่อด้วยเครน ประเมิน JSA ไม่ครอบคลุม,1,งานยกแผ่นคอนกรีตขึ้นจากบ่อด้วยเครน ประเมิน jsa ไม่ครอบคลุม,"Lifting concrete slabs from the pit with a crane, not covered by jsa assessment"
1303,HOT,H-100A,RNC,Unsafe Condition,Scaffolding,วางแผ่นนั่งร้านบนบันไดเพื่อยืนรับ-ส่งอุปกรณ์ โดยไม่ได้ล็อคแผ่นนั่งร้าน,102,"วางแผ่นนั่งร้านบนบันได, ยืนรับ-ส่งอุปกรณ์ โดยไม่ได้ล็อคแผ่นนั่งร้าน","Place the scaffolding sheet on the ladder, stand to pick-up equipment. without locking the scaffolding plate"
378,Olefins2,Line blow down,UTOC,Unsafe Condition,Lifting,รอกที่นำมาใช้งาน Safety Latch ชำรุด,1,รอกที่นำมาใช้งาน safety latch ชำรุด,The pulley used to use the safety latch is damaged.
1048,HOT,H-100G,RNC,Unsafe Condition,Hot Work,ใช้ Pallet ไม้วางรองอุปกรณ์เพื่อทำงานเจียรแต่ง,5,"ใช้ pallet ไม้วางรองอุปกรณ์, ทำงานเจียรแต่ง","Use wooden pallets to support equipment, work on grinding"
2471,UT,F-3320B,R-Five,Unsafe Condition,Civil,จุดเต้นท์พักคนงานมีวัสดุอุปกรณ์วางกีดขวางพื้นที่ และมีน้ำขัง ชื้นแฉะ เสี่ยงต่อการเดินสะดุดลื่นล้ม (ดำเนินการ 5ส พื้นที่และกำหนดจุดวางถังน้ำใหม่ เรียบร้อย),1,"จุดเต้นท์พักคนงานมีวัสดุอุปกรณ์วางกีดขวางพื้นที่ , มีน้ำขัง ชื้นแฉะ เสี่ยงต่อการเดินสะดุดลื่นล้ม (ดำเนินการ 5ส พื้นที่, กำหนดจุดวางถังน้ำใหม่ เรียบร้อย)","The worker's tent area has materials and equipment obstructing the area, there is waterlogging, damp, risk of slipping and falling."
626,HOT,E-201B,KC,Unsafe Condition,Housekeeping,ไม่จัดเก็บขวดน้ำดื่ม,5,ไม่จัดเก็บขวดน้ำดื่ม,Do not store drinking bottles
3560,HDPE3,Unknown,Unknown,Unsafe Condition,Unknown,มีการสวมใส่อุปกรณ์ป้องกันการตกแต่ไม่คล้องเกี่ยว,2,มีการสวมใส่อุปกรณ์ป้องกันการตกแต่ไม่คล้องเกี่ยว,Fall protection equipment is worn but not involved.
3287,Catalyst&Pilot plant,Unknown,Unknown,Unsafe Action,Unknown,ตรวจสอบพบเอกสาร SE-F-0189 Rev.007 Fire Watch ไม่ลงข้อมูลในข้อ 3 (การเฝ้าระวังหลังเสร็จสิ้นการปฎิบัติงาน) ลงเพียงเวลาเริ่มงานในช่วงเช้า ไม่ลงรายระเอียด สิ้นสุดการเฝ้าระวังในช่วงเช้าและลงลายมือชื่อในช่วงเช้า (ตามรูปแนบ),2,"ตรวจสอบพบเอกสาร se-f-0189 rev.007 fire watch ไม่ลงข้อมูลในข้อ 3 (การเฝ้าระวังหลังเสร็จสิ้นการปฎิบัติงาน) ลงเพียงเวลาเริ่มงานในช่วงเช้า ไม่ลงรายระเอียด สิ้นสุดการเฝ้าระวังในช่วงเช้า, ลงลายมือชื่อในช่วงเช้า (ตามรูปแนบ)","Checked that document se-f-0189 rev.007 fire watch did not enter item 3 (post-work watch out) only at the start of work in the morning. do not go into detail End of surveillance in the morning, sign in the morning (see attached picture)."
3133,PP3,Unknown,Unknown,Unsafe Condition,Unknown,พบการขับขี่จักรยานในพื้นที่ process ซึ่งมีป้ายเตือนชัดเจน ว่าห้ามรถทุกชนิดเข้าโดยเด็ดขาด,1,พบการขับขี่จักรยานในพื้นที่ process ซึ่งมีป้ายเตือนชัดเจน ว่าห้ามรถทุกชนิดเข้าโดยเด็ดขาด,"Cyclists were found in the process area, which was clearly marked with warning signs. that all kinds of vehicles are strictly prohibited from entering"
2873,Ware house Site7,Unknown,Unknown,Unsafe Condition,Unknown,safety latch ขอตะขอยก หลุดออกจากตัวตะขอ เวลายกของ สลิงอาจหลุดออกจากตะขอได้ ,1,safety latch ขอตะขอยก หลุดออกจากตัวตะขอ เวลายกของ สลิงอาจหลุดออกจากตะขอได้,"safety latch The hook of the lifting hook is dislodged from the hook. When lifting, the sling may come off the hook."
2860,HDPE3,Unknown,Unknown,Unsafe Action,Unknown,พบการ Lock ระบบ LOTO ยังไม่ถูกต้อง และ ไม่พบเอกสารลงข้อมูลที่จุด,6,"พบการ lock ระบบ loto ยังไม่ถูกต้อง , ไม่พบเอกสารลงข้อมูลที่จุด","Found lock system loto is not valid yet, no document found at the point"
2729,LDPE,Unknown,Unknown,Unsafe Action,Unknown,ตรวจสอบพบอุปกรณ์ช่วยยก ยังไม่ได้รับการตรวจสอบและออกสติกเกอร์,10,"ตรวจสอบพบอุปกรณ์ช่วยยก ยังไม่ได้รับการตรวจสอบ, ออกสติกเกอร์","Check to find lifting equipment. Has not been verified, issued a sticker."
2716,Catalyst&Pilot plant,Unknown,Unknown,Unsafe Action,Unknown,ตรวจสอบเอกสารพบ Safe Work Certificate SE-F-0286_Rev.002 (เก่า) ,48,ตรวจสอบเอกสารพบ safe work certificate se-f-0286_rev.002 (เก่า),Examine the document and find a safe work certificate se-f-0286_rev.002 (old).
3265,HDPE4,Unknown,Unknown,Unsafe Action,Unknown,ผู้ขออนุญาตไม่ได้กำหนดมาตรการ เรื่องการใช้อุปกรณ์ PPE ตามลักษณะงาน,2,ผู้ขออนุญาตไม่ได้กำหนดมาตรการ เรื่องการใช้อุปกรณ์ ppe ตามลักษณะงาน,The applicant does not impose measures. Regarding the use of ppe equipment according to the nature of the job
3719,HDPE1,Unknown,Unknown,Unsafe Action,Unknown,ตรวจสอบเอกสาร Work Permit พบไม่ลงข้อมูล LOTO ทวนสอบที่กล่องล๊อคบล๊อค LOTO ล๊อคครบ,21,ตรวจสอบเอกสาร work permit พบไม่ลงข้อมูล loto ทวนสอบที่กล่องล๊อคบล๊อค loto ล๊อคครบ,"Check the work permit document. Found that there is no loto information entered. Verify that the lock box, lock loto, complete lock."
3372,PP3,Unknown,Unknown,Unsafe Action,Unknown,ผู้ขออนุญาต ไม่ประเมินความเสี่ยงเรื่องการทำงานยก และการทำงานบนที่สูง,24,"ผู้ขออนุญาต ไม่ประเมินความเสี่ยงเรื่องการทำงานยก , การทำงานบนที่สูง","The applicant does not assess the risk of lifting work, working at height."
3396,HDPE2,Unknown,Unknown,Unsafe Action,Unknown,ประเมิน JSA ไม่ครอบคลุม  มีการลงไปทำงานใต้พื้น Floor และ ทำในตู้ Control แต่ไม่มีการประเมินถึงอันตราย และ มาตรการป้องกัน,11,"ประเมิน jsa ไม่ครอบคลุม มีการลงไปทำงานใต้พื้น floor , ทำในตู้ control แต่ไม่มีการประเมินถึงอันตราย , มาตรการป้องกัน","The jsa assessment is not comprehensive, there is work under the floor, in the control cabinet, but there is no hazard assessment, preventive measures."
3311,PP2,Unknown,Unknown,Unsafe Action,Unknown,งานที่ทำคืองานตั้งนั่งร้าน  ไม่ตรงกับงานที่ระบุใน  work permit&JSA. ที่เป็นงานขนย้ายอุปกรณ์,1,"งานที่ทำคืองานตั้งนั่งร้าน ไม่ตรง, งานที่ระบุใน work permit, jsa. ที่เป็นงานขนย้ายอุปกรณ์","The work that is done is the work of setting up the scaffolding, not straight, the work specified in the work permit, jsa."
3186,PP3,Unknown,Unknown,Unsafe Action,Unknown,ใช้อุปกรณ์(บล๊อกลม) แต่ไม่ได้ประเมินความเสี่ยงใน JSA,8,ใช้อุปกรณ์(บล๊อกลม) แต่ไม่ได้ประเมินความเสี่ยงใน jsa,Use a device (wind block) but do not evaluate the risks in jsa.
434,Olefins2,A1,TTCL,Unsafe Condition,Housekeeping,กองอุปกรณ์ และ Scrap,7,"กองอุปกรณ์ , scrap","pile of equipment, scrap"
1941,HOT,H-100G,RNC,Unsafe Condition,Lifting,สลิงผ้าใบที่ใช้ในงานยกมีสภาพเก่าใกล้ชำรุด,4,สลิงผ้าใบที่ใช้ในงานยกมีสภาพเก่าใกล้ชำรุด,The canvas slings used in lifting work are old and almost damaged.
3635,Pilot plant complex,Unknown,Unknown,Unsafe Action,Unknown,Lifting Plan ยังไม่อัพเดทเป็น Rev.5 ปัจจุบัน,19,lifting plan ยังไม่อัพเดทเป็น rev.5 ปัจจุบัน,The lifting plan hasn't been updated to the current rev.5.
2840,Catalyst&Pilot plant,Unknown,Unknown,Unsafe Condition,Unknown,ตรวจสอบ JSA พบขาดการตรวจสอบมาตราการจหัวข้อ 6.1 โดย Safety Lead ,12,ตรวจสอบ jsa พบขาดการตรวจสอบมาตราการจหัวข้อ 6.1 โดย safety lead,Check jsa found missing check section 6.1 by safety lead.
2841,Bagging Site3,Unknown,Unknown,Unsafe Condition,Unknown,พบมีการนำน้ำยา WD-40 มาใช้ที่หน้างานและไม่มีการจัดเก็บโดยวางทิ้งไว้บริเวณหน้างานตัด-เจียร,1,"พบมีการนำน้ำยา wd-40 มาใช้ที่หน้างาน, ไม่มีการจัดเก็บโดยวางทิ้งไว้บริเวณหน้างานตัด-เจียร","wd-40 was found to be used at the work site, not stored and left in the cutting-grinding area."
2842,Ware house Site7,Unknown,Unknown,Unsafe Condition,Unknown,พบเก้าอี้ชำรุด ขาหัก ไม่ติดป้ายห้ามใช้,1,พบเก้าอี้ชำรุด ขาหัก ไม่ติดป้ายห้ามใช้,"Found a damaged chair, broken leg, no sign forbidden to use."
1566,Olefins2,SDF-211,REPCO (MES),Unsafe Action,PTW & JSA,ข้อมูลใน WAH Certificate ไม่ครบถ้วน,32,ข้อมูลใน wah certificate ไม่ครบถ้วน,The information in the wah certificate is incomplete.
3157,QA&QC Site7,Unknown,Unknown,Unsafe Action,Unknown,ตรวจสอบพบเครื่องดูดฝุ่นที่นำมาใช้ ตรวจสภาพแล้ว แต่สติ๊กเกอร์ตรวจสภาพยังไม่เป็นปัจจุบัน ,1,ตรวจสอบพบเครื่องดูดฝุ่นที่นำมาใช้ ตรวจสภาพแล้ว แต่สติ๊กเกอร์ตรวจสภาพยังไม่เป็นปัจจุบัน,"A vacuum cleaner that has been used has been inspected, but the inspection sticker is not up-to-date."
3180,PP1,Unknown,Unknown,Unsafe Action,Unknown,ตรวจสอบพบนั่งร้าน TAG นั่งร้านหมดอายุ ยังไม่ได้ Update 07-14/05/65,14,"ตรวจสอบพบนั่งร้าน tag นั่งร้านหมดอายุ ยังไม่ได้ update 07-14, 05, 65","Examine the scaffolding tag. The scaffolding has expired and has not been updated 07-14, 05, 65."
3634,Bagging Site7,Unknown,Unknown,Unsafe Action,Unknown,มีการตัดแยกระบบแบบ simple lock แต่ผู้ขออนุญาตไม่ได้ลงเลข simple lockที่work permit,14,มีการตัดแยกระบบแบบ simple lock แต่ผู้ขออนุญาตไม่ได้ลงเลข simple lockที่work permit,"There is a simple lock system separation, but the applicant does not enter the simple lock number on the work permit."
3705,PP1,Unknown,Unknown,Unsafe Action,Unknown,ตรวจสอบพบ Mask ช่างเชื่อม ตัว Body หมดอายุมีการใช้งานเกิน 5 ปี,4,ตรวจสอบพบ mask ช่างเชื่อม ตัว body หมดอายุมีการใช้งานเกิน 5 ปี,The welder's mask was found to have expired and had been used for more than 5 years.
2748,PP2,Unknown,Unknown,Unsafe Action,Unknown,ตรวจสอบเอกสา Safe Work Certificate งานยก SE-F-0213 Rev.004 พบการตรวจสอบเอกสารในหัวข้อ 2.3 และ 2.5 มีการลงข้อมูลแต่หน้างานจริงไม่มีปฏิบัติ ,42,"ตรวจสอบเอกสา safe work certificate งานยก se-f-0213 rev.004 พบการตรวจสอบเอกสารในหัวข้อ 2.3 , 2.5 มีการลงข้อมูลแต่หน้างานจริงไม่มีปฏิบัติ","Examine the document safe work certificate lifting work se-f-0213 rev.004 found document examination in topics 2.3, 2.5, information is posted but there is no actual work."
3082,Catalyst&Pilot plant,Unknown,Unknown,Unsafe Action,Unknown,ตรวจสอบพบงานเชื่อมโดยผู้ปฏิบัติงนร่วมในพื้นที่ไม่สวมใส่ MASK ป้องกันอันตรายจากฟูมงานเชื่อม,17,ตรวจสอบพบงานเชื่อมโดยผู้ปฏิบัติงนร่วมในพื้นที่ไม่สวมใส่ mask ป้องกันอันตรายจากฟูมงานเชื่อม,Check that welding work is done by workers in the area who do not wear masks to prevent danger from welding fume.
2850,CPD Site1,Unknown,Unknown,Unsafe Condition,Unknown,ตรวจสอบเอกสาร Certificate SE-F-0189_Rev.009 พบมีการลงข้อมูลมี Fire Watch 2 คน แต่ยังไม่ได้สอบขึ้นทะเบียนในปี 65 นี้,1,ตรวจสอบเอกสาร certificate se-f-0189_rev.009 พบมีการลงข้อมูลมี fire watch 2 คน แต่ยังไม่ได้สอบขึ้นทะเบียนในปี 65 นี้,"Check the certificate se-f-0189_rev.009 document. Found that there was information posted, there were 2 fire watches, but they hadn't passed the registration exam this year."
2849,CPD Site1,Unknown,Unknown,Unsafe Action,Unknown,ตรวจสอบพบผู้ปฏิบัติงานเชื่อมไม่สวมใส่ MASK ขณะปฏิบัติงานเชื่อม ,19,ตรวจสอบพบผู้ปฏิบัติงานเชื่อมไม่สวมใส่ mask ขณะปฏิบัติงานเชื่อม,Check that welding workers do not wear masks while working.
3141,PP1,Unknown,Unknown,Unsafe Action,Unknown,ตรวจสอบพบงานเชื่อม พบช่างประกอบไม่สวมใส่ MASK ที่ป้องกันอันตรายจาก ฟูม งานเชื่อม,8,ตรวจสอบพบงานเชื่อม พบช่างประกอบไม่สวมใส่ mask ที่ป้องกันอันตรายจาก ฟูม งานเชื่อม,check welding work It was found that assemblers do not wear masks that protect against welding fumes.
1168,HOT,E-201B,RMS,Unsafe Action,SL Performance,Safety Lead บัตรหมดอายุ,3,safety lead บัตรหมดอายุ,safety lead expired card
2851,CPD Site1,Unknown,Unknown,Unsafe Action,Unknown,ตรวจสอบอุปกรณ์ที่นำมาใช้ในงาน H/W Class I ผ้ากันไฟสภาพไม่พร้อมใช้งานและยังไม่ได้ตรวจสภาพจาก Safety Repco Regulator ยังไม่ได้ตรวจสอบ Grinder ไม่มี Handle,1,"ตรวจสอบอุปกรณ์ที่นำมาใช้ในงาน h, w class i ผ้ากันไฟสภาพไม่พร้อมใช้งาน, ยังไม่ได้ตรวจสภาพจาก safety repco regulator ยังไม่ได้ตรวจสอบ grinder ไม่มี handle","Inspect the equipment used in the job h, w class i fire retardant fabric condition not available, not inspected by safety repco regulator, not inspected grinder without handle"
3134,Catalyst&Pilot plant,Unknown,Unknown,Unsafe Condition,Unknown,ตรวจสอบพบงานเจียร Grinding ไม่ใส่ Handle ขณะทำการเจียร ,1,ตรวจสอบพบงานเจียร grinding ไม่ใส่ handle ขณะทำการเจียร,Check that grinding work is not inserted on the handle while grinding.
