FindingNo,Area,SubArea,Contractor,TypeOfFinding,Topic,Details,Frequency,CleansingDetails,TranslateDetails
3505,Catalyst&Pilot plant,Unknown,Unknown,Unsafe Condition,Unknown,ตรวจสอบพบคู่ร่วมธุรกิจขึ้นทำงานบนที่สูงโดยออกจากนั่งร้านและทำงานบน Line Pipe อันตรายอาจจะพลาดตกจากที่สูง,3,"ตรวจสอบพบคู่ร่วมธุรกิจขึ้นทำงานบนที่สูงโดยออกจากนั่งร้าน, ทำงานบน line pipe อันตรายอาจจะพลาดตกจากที่สูง","Checked to find business partners working at heights by leaving the scaffolding, working on line pipes, the danger may be missed falling from a height."
1626,HOT,H-100B,RNC,Unsafe Condition,Work at height,ช่องเปิด Grating ด้านหน้า Fire Box Access door ชั้น 1 ,1,ช่องเปิด grating ด้านหน้า fire box access door ชั้น 1,Front grating opening fire box access door 1st floor
1752,HOT,PSV-360A,WTM,Unsafe Condition,Scaffolding,ปิดล้อมพื้นที่ติดกับนั่งร้านที่กำลังติดตั้ง,11,"ปิดล้อมพื้นที่ติด, นั่งร้านที่กำลังติดตั้ง","enclose the adjacent area, the scaffolding being installed"
1628,HOT,H-100C,RNC,Near Miss,Insulation,เวลาประมาณ 14.25 น.ขณะทำการ Re-tube TLE(อุปกรณ์ E-100C)จังหวะสอด tube(ตัวใหม่)เข้าด้านใน TLE และ lock ด้วย clamp เพื่อที่จะวาง tube ให้นั่งอยู่กับ tube sheet ด้านบนของ TLE tube ได้รูดตกลงมาด้านล่าง กระแทกกับแผ่น plate ที่รองอยู่ด้านล่าง ไม่มีผู้ได้รับบาดเจ็บและทรัพย์สินเสียหาย (clamp ที่ใช้ล็อคขันยึดไม่แน่น ทำให้เมื่อปล่อยรอกที่ต๋ง tube จึงรูดตกลงด้านล่าง),1,"เวลาประมาณ 14.25 น.ขณะทำการ re-tube tle(อุปกรณ์ e-100c)จังหวะสอด tube(ตัวใหม่)เข้าด้านใน tle , lock ด้วย clamp , ที่จะวาง tube ให้นั่งอยู่, tube sheet ด้านบนของ tle tube ได้รูดตกลงมาด้านล่าง กระแทก, แผ่น plate ที่รองอยู่ด้านล่าง ไม่มีผู้ได้รับบาดเจ็บ, ทรัพย์สินเสียหาย (clamp ที่ใช้ล็อคขันยึดไม่แน่น ทำให้เมื่อปล่อยรอกที่ต๋ง tube จึงรูดตกลงด้านล่าง)","Around 2:25 p.m., while re-tube tle (equipment e-100c), insert rhythm tube(new) inside the tle , lock with clamp , to place the tube to sit on , tube sheet on top of the tle tube slides down , bumping , the plate supporting the bottom No injuries, property damage (clamp used to lock is not tightened Causing when releasing the pulley at the tube, so it falls down below)"
1630,UT,TK-2411,NALCO,Unsafe Condition,Chemical Work,สารเคมีซึมออกมาเป็นหยดๆ (1 นาที/หยด) ที่ข้อต่อหน้าแปลนกับสาย load NaClO,1,"สารเคมีซึมออกมาเป็นหยดๆ (1 นาที, หยด) ที่ข้อต่อหน้าแปลน, สาย load naclo","Chemical seep out in drips (1 min., drop) at flange joints, naclo load hoses."
981,HOT,H-100E,RNC,Unsafe Action,Scaffolding,ผู้ปฏิบัติงานคล้องเกี่ยว Safety Harness ในระดับต่ำกว่าศีรษะ,1,ผู้ปฏิบัติงานคล้องเกี่ยว safety harness ในระดับต่ำกว่าศีรษะ,The worker is attached to the safety harness below the head level.
1444,Olefins2,-,TTCL,Unsafe Condition,Hot Work,"Generator ไม่มี Extinguisher stand by
",4,"generator ไม่มี extinguisher stand by,","generator without extinguisher stand by,"
1860,TFU,TK-1010B,INSEE,Unsafe Condition,Electrical & Grounding,ต่อสาย Ground  ร่วมกับ Ground ของ Plant,5,"ต่อสาย ground ร่วม, ground ของ plant","Connect the common ground wire, the ground of the plant."
1969,HOT,H-100F,RNC,Unsafe Action,PTW & JSA,JSA งาน Remove Insulation ประเมินความเสี่ยงไม่ครอบคลุม,4,jsa งาน remove insulation ประเมินความเสี่ยงไม่ครอบคลุม,"jsa remove insulation work, risk assessment is not covered"
976,HOT,PSV-2023BC,LEO,Unsafe Action,PPE,งาน test safety ใช้ถุงมือผ้าไม่เหมาะสม,2,งาน test safety ใช้ถุงมือผ้าไม่เหมาะสม,"In test safety work, use of cloth gloves is not appropriate."
67,HOT,H-100D,RNC,Unsafe Condition,Work at height,ไม่มีเชือกคล้องเกี่ยวประแจที่นำมาใช้งาน,9,ไม่มีเชือกคล้องเกี่ยวประแจที่นำมาใช้งาน,There is no rope attached to the wrench that is used.
1676,HOT,H-100E,RNC,Unsafe Condition,Work at height,วางเครื่องมือไว้หมิ่นต่อการตกจากที่สูง,2,วางเครื่องมือไว้หมิ่นต่อการตกจากที่สูง,Place the tool on the verge of falling from a height.
1859,HOT,H-100E,RNC,Unsafe Condition,CSE,Hole Watch ไม่มีวิทยุสื่อสารติดต่อกับผู้ปฏิบัติงานด้านใน (Concern ผู้ปฏิบัติงานที่ทำงานบนนั่งร้านด้านใน Fire Box),1,"hole watch ไม่มีวิทยุสื่อสารติดต่อ, ผู้ปฏิบัติงานด้านใน (concern ผู้ปฏิบัติงานที่ทำงานบนนั่งร้านด้านใน fire box)","hole watch no radio contact, operator inside (concern operator working on scaffolding inside fire box)"
1861,Olefins2,D-S2001,MOC (OPE),Unsafe Condition,Pressure test,มีไอ steam  blow ออกสู่บรรยากาศ และ drain condensate ลงรางระบายน้ำ จึงได้ทำการล้อมด้วยธงขาวแดงชั่วคราว,1,"มีไอ steam blow ออกสู่บรรยากาศ , drain condensate ลงรางระบายน้ำ จึงได้ทำการล้อมด้วยธงขาวแดงชั่วคราว","There is steam blow into the atmosphere, drain condensate down the drain. therefore temporarily surrounded by red and white flags"
1864,OCU,Jet yard,LINDE,Unsafe Action,Transportation,พนักงานขับรถลืมสวมใส่หมวก,1,พนักงานขับรถลืมสวมใส่หมวก,The driver forgot to wear a helmet.
3013,Blownfilm,Unknown,Unknown,Unsafe Action,Unknown,พบ Safety Lead  ทำเกินหน้าที่ๆกำหนด            ( Safety ลงมือทำงานกับทีมงานใน Line ),1,"พบ safety lead ทำเกินหน้าที่ๆกำหนด ( safety ลงมือทำงาน, ทีมงานใน line )","Found a safety lead to do more than the assigned duty (safety to work, team in line)"
2114,HOT,H-100A,RNC,Unsafe Condition,Scaffolding,ผูกมัดแผ่นนั่งร้านด้วยลวด ไม่แน่นหนา,6,ผูกมัดแผ่นนั่งร้านด้วยลวด ไม่แน่นหนา,"Tie the scaffolding planks with wire, not firmly."
643,HOT,D-203,REPCO (MES),Unsafe Action,PTW & JSA,HOT-HH-002 ใช้ Lifting plan version เก่า,7,hot-hh-002 ใช้ lifting plan version เก่า,hot-hh-002 uses the old lifting plan version.
1876,TFU,Diversion Box,MOC (OPE),Unsafe Condition,Housekeeping,เศษขยะในบ่อ,1,เศษขยะในบ่อ,garbage in the pond
15,HOT,H-100E,RNC,Unsafe Condition,Lifting,ไม่มีผ้ารองสลิงผ้าใบกันบาด,15,ไม่มีผ้ารองสลิงผ้าใบกันบาด,"There is no sling cloth, cut resistant canvas."
1449,COLD,E-505A,JS Tech,Unsafe Condition,Hot Work,จุดวางถัง Argon อยู่ในตำแหน่งของ Line of fire,1,จุดวางถัง argon อยู่ในตำแหน่งของ line of fire,The argon tank is placed in the line of fire position.
336,HOT,ด้านหน้า Compressor,MXM,Unsafe Action,PTW & JSA,มีการแก้ไขประเภทของ PTW,1,มีการแก้ไขประเภทของ ptw,The type of ptw has been fixed.
763,HOT,TK-259,NALCO,Unsafe Action,Chemical Work,ทีมงานโหลดสารเคมีไม่นำ Face shield ขณะทำงาน,16,ทีมงานโหลดสารเคมีไม่นำ face shield ขณะทำงาน,Workers loading chemicals do not bring face shields while working.
173,TFU,LA-1830,Flow lab,Unsafe Action,Lifting,งานยกขนย้ายอุปกรณ์โดยเฮี้ยบ ผู้ให้สัญญาณสวมเสื้อสะท้อนแสงสีน้ำเงิน,21,งานยกขนย้ายอุปกรณ์โดยเฮี้ยบ ผู้ให้สัญญาณสวมเสื้อสะท้อนแสงสีน้ำเงิน,Lifting and moving equipment by Hiab The signalman wears a blue reflective vest.
1478,HOT,E-201A,MOC (OPE),Unsafe Condition,Pressure test,จุด connect สาย hose ไม่มี Safety sling/ ใช้ลวดมัด,12,"จุด connect สาย hose ไม่มี safety sling, ใช้ลวดมัด","Hose connection point, no safety sling, use tie wire"
2120,Interpipe,-,R-Five,Unsafe Condition,Hot Work,เครื่องขัดแนวเชื่อมไม่มี Handle,1,เครื่องขัดแนวเชื่อมไม่มี handle,Weld polishing machine without handle
1101,Olefins2,R4,TTCL,Unsafe Condition,Housekeeping,เศษพลาสติกหลังหุ้ม insulation,6,เศษพลาสติกหลังหุ้ม insulation,plastic scraps behind insulation
2257,UT,T-2400F,"WTM, REPCO (MES)",Unsafe Action,PTW & JSA,"ตรวจสอบ Safe Work Cert. งาน CSE ว่ามีการทำงาน HW I, มีการใช้งานอุปกรณ์ไฟฟ้า ซึ่งไม่เกี่ยวข้องที่หน้างาน",8,"ตรวจสอบ safe work cert. งาน cse ว่ามีการทำงาน hw i , มีการใช้งานอุปกรณ์ไฟฟ้า ซึ่งไม่เกี่ยวข้องที่หน้างาน","Check safe work cert. cse work hw i work, electrical equipment is used. which is not relevant at the job site"
2188,Olefins2,PR-16,CAPK,Unsafe Condition,Hot Work,งานตัดเชื่อมเจียรSupport pipe ปิดกั้นผ้ากันไฟไม่มิดชิดมีลูกไฟกระเด็นออก นอกผ้ากันไฟ,9,งานตัดเชื่อมเจียรsupport pipe ปิดกั้นผ้ากันไฟไม่มิดชิดมีลูกไฟกระเด็นออก นอกผ้ากันไฟ,"Cutting, welding, grinding, support pipe, completely blocking the fireproof fabric, the fireball bounces off the fireproof fabric."
2131,OCU,Clean yard,WTM,Unsafe Condition,Transportation,"วาง Material บนรถบรรทุกซ้อนกันในลักษณะไม่ปลอดภัย
1.ซ้อนกันไม่สนิท
2.ไม่มีขอบกระบะป้องกันการตก",1,"วาง material บนรถบรรทุกซ้อนกันในลักษณะไม่ปลอดภัย, 1.ซ้อนกันไม่สนิท, 2.ไม่มีขอบกระบะป้องกันการตก","Stacking materials on trucks in an unsafe manner, 1. Not completely stacked, 2. No edge of the bed to prevent falling."
3716,PP3,Unknown,Unknown,Unsafe Action,Unknown,ไม่ระบุ PPE ที่ใช้ ให้สอดคล้องตามลักษณะงาน และที่ระบุใน JSA,5,"ไม่ระบุ ppe ที่ใช้ ให้สอดคล้องตามลักษณะงาน , ที่ระบุใน jsa","Do not specify the ppe used according to the nature of the job , specified in jsa"
697,HOT,D-203,NALCO,Unsafe Condition,Chemical Work,งานยกโหลด Polymer การปิดกั้นพื้นที่ ใช้ยูโรเทปแทนธงแดง,1,งานยกโหลด polymer การปิดกั้นพื้นที่ ใช้ยูโรเทปแทนธงแดง,lifting load polymer blocking area Use euro tapes instead of red flags.
2136,HOT,H-120R,RNC,Unsafe Condition,Housekeeping,รถเข็นขวางจอดกีดขวางทางเดิน,1,รถเข็นขวางจอดกีดขวางทางเดิน,The cart blocked the aisle.
1253,HOT,"TK-3200
",MOC (OPE),Unsafe Condition,Housekeeping,ถุงทรายกีดขวางการ operate อุปกรณ์และไม่ได้จัดเก็บเศษขยะบริเวณโดยรอบ,1,"ถุงทรายกีดขวางการ operate อุปกรณ์, ไม่ได้จัดเก็บเศษขยะบริเวณโดยรอบ","Sandbags obstruct the operation of the equipment, do not collect the surrounding debris."
2141,OCU,E-711,REPCO (EE),Unsafe Action,Electrical & Grounding,งาน Check grounding ช่างถอดหมากขณะปฏิบัติงาน,1,งาน check grounding ช่างถอดหมากขณะปฏิบัติงาน,check grounding work
3512,PP3,Unknown,Unknown,Unsafe Action,Unknown,มีการทำงานที่สูง บนนั่งร้าน แต่ไม่ได้ประเมินความเสี่ยง เรื่องการทำงานที่สูงบนนั่งร้าน,4,มีการทำงานที่สูง บนนั่งร้าน แต่ไม่ได้ประเมินความเสี่ยง เรื่องการทำงานที่สูงบนนั่งร้าน,"There is work at height on scaffolding, but the risk is not assessed. About working at height on scaffolding"
897,HOT,H-100B,RNC,Unsafe Condition,Work at height,ช่องเปิดไม่มี Toe-Board บริเวณ Cover U-Bend Cross over#4,1,ช่องเปิดไม่มี toe-board บริเวณ cover u-bend cross over#4,No toe-board opening at cover u-bend cross over #4
1636,TFU,TK-1010B,NCN,Unsafe Condition,CSE,ไฟ LED 24 volt (ค้างประเด็นการนำเข้า CSE ต้องเป็น Explosion prrof),1,ไฟ led 24 volt (ค้างประเด็นการนำเข้า cse ต้องเป็น explosion prrof),24 volt leds (freeze issue cse import must be explosion prrof)
1882,HOT,H-100A,RNC,Unsafe Condition,Hot Work,ใช้ผ้าใบกันลมปูพื้นรองเศษเหล็กจากงาน HW I,1,ใช้ผ้าใบกันลมปูพื้นรองเศษเหล็กจากงาน hw i,Use a windproof canvas to lay the floor under the scrap metal from the hw i event.
3202,Blownfilm,Unknown,Unknown,Unsafe Action,Unknown,พบมีการนำเอกสารเก่ามาใช้งาน ( Rev.02 ),4,พบมีการนำเอกสารเก่ามาใช้งาน ( rev.02 ),An old document was found to be used (rev.02).
3730,CPD Site1,Unknown,Unknown,Unsafe Action,Unknown,ตรวจสอบ JSA พบมีการระบุถึง หินเจียร์ 4 นิ้ว ต้องมีด้ามจับ (Handle) พบผู้ปฏิบัติงานไม่สวมใส่ Handle ขณะปฏิบัติงาน,11,ตรวจสอบ jsa พบมีการระบุถึง หินเจียร์ 4 นิ้ว ต้องมีด้ามจับ (handle) พบผู้ปฏิบัติงานไม่สวมใส่ handle ขณะปฏิบัติงาน,"Inspected jsa, it was found that a 4-inch grinding wheel must have a handle. The operator did not wear the handle while working."
3120,HDPE2,Unknown,Unknown,Unsafe Action,Unknown,พบเอกสาร JSA ไม่มีการตรวจสอบมาตรการหน้างานก่อนมีการปฏิบัติงาน,27,พบเอกสาร jsa ไม่มีการตรวจสอบมาตรการหน้างานก่อนมีการปฏิบัติงาน,Found jsa documents. There is no on-site inspection of measures before implementation.
3257,HDPE1,Unknown,Unknown,Unsafe Action,Unknown,ผู้ปฏิบัติงานตั้งนั่งร้าน ยืนอยู่บน blower,1,ผู้ปฏิบัติงานตั้งนั่งร้าน ยืนอยู่บน blower,"A worker erects a scaffold, standing on the blower."
3259,PP3,Unknown,Unknown,Unsafe Condition,Unknown,ไม่ได้ประเมินความเสี่ยงเรื่องการต่อสายไฟจากMain สู่เครื่องAir รวมถึงเรื่องการตัดแยกระบบพลังงาน,1,ไม่ได้ประเมินความเสี่ยงเรื่องการต่อสายไฟจากmain สู่เครื่องair รวมถึงเรื่องการตัดแยกระบบพลังงาน,Did not assess the risk of connecting the mains cable. to the air Including the issue of disconnecting the energy system.
770,ARU,ATG-8721,REPCO (IE),Near Miss,Process & Operation,ATG-8721Alarm High ให้F/Oทำการตรวจสอบพื้นที่แต่ไม่พบสิ่งผิดปกติจึงแจ้งงาน ให้IE ตรวจอุปกรณ์หน้างาน,1,"atg-8721alarm high ให้f, oทำการตรวจสอบพื้นที่แต่ไม่พบสิ่งผิดปกติจึงแจ้งงาน ให้ie ตรวจอุปกรณ์หน้างาน","atg-8721alarm high give f, o check the area but no abnormality found, then notify the job to ie check the equipment at the job site."
3334,PP3,Unknown,Unknown,Unsafe Action,Unknown,พบTag นั่งร้านหมดอายุ,14,พบtag นั่งร้านหมดอายุ,Found an expired scaffolding tag.
3109,Store Site7,Unknown,Unknown,Near Miss,Unknown,พบประตูหลัง จุดเก็บพัสดุ ล้ม,1,พบประตูหลัง จุดเก็บพัสดุ ล้ม,"Found the back door, the parcel collection point, fell."
3112,HDPE1,Unknown,Unknown,Unsafe Condition,Unknown,Diesel gen. House ชุดแบตเตอร์รี่ ไม่ได้ครอบฝาปิด มีความเสี่ยงที่จะทำให้เกิดการช๊อตของขั้วแบต หากมีโลหะตกลงไป,1,diesel gen. house ชุดแบตเตอร์รี่ ไม่ได้ครอบฝาปิด มีความเสี่ยงที่จะทำให้เกิดการช๊อตของขั้วแบต หากมีโลหะตกลงไป,diesel gen. house battery pack lid not covered There is a risk of shorting the battery terminals. If metal falls
3113,LLDPE,Unknown,Unknown,Unsafe Condition,Unknown,มีถังน้ำมันวางอยู่ไม่ได้จัดเก็บใน bund หากเกิดการรั่วจะไหลลงรางระบายน้ำฝน และ v-ditch,1,"มีถังน้ำมันวางอยู่ไม่ได้จัดเก็บใน bund หากเกิดการรั่วจะไหลลงรางระบายน้ำฝน , v-ditch","There is a fuel tank placed not stored in the bund. If there is a leak, it will flow into the rain gutter, v-ditch."
3114,PP1,Unknown,Unknown,Near Miss,Unknown,Valve ที่ใช้ isolate air supply to slide gate valve Z-557E ชำรุด ( Complex lock B8 ),1,valve ที่ใช้ isolate air supply to slide gate valve z-557e ชำรุด ( complex lock b8 ),valve used to isolate air supply to slide gate valve z-557e is defective ( complex lock b8 )
3115,HDPE1,Unknown,Unknown,Unsafe Condition,Unknown,ประตูทางเข้าหม้อแปลง HD-PTR-0106 ไม่ได้ lock ไว้ ผู้ที่ไม่เกี่ยวข้องจะเข้าสัมผัสกับอันตรายจากไฟฟ้าแรงสูงได้,1,"ประตูทางเข้าหม้อแปลง hd-ptr-0106 ไม่ได้ lock ไว้ ผู้ที่ไม่เกี่ยวข้องจะเข้าสัมผัส, อันตรายจากไฟฟ้าแรงสูงได้","The entrance door to the hd-ptr-0106 transformer is not locked, unrelated people can touch it, dangerous from high voltage."
3116,Truck scale Site7,Unknown,Unknown,Unsafe Condition,Unknown,ตรวจสอบพื้นที่พบทางขึ้นเครื่องชั่งฝั่งขาออก พื้นผิวคอนกรีตชำรุด แตกร้าว เป็นแอ่ง ,1,ตรวจสอบพื้นที่พบทางขึ้นเครื่องชั่งฝั่งขาออก พื้นผิวคอนกรีตชำรุด แตกร้าว เป็นแอ่ง,"Check the area where the entrance to the scale is found on the departure side. The concrete surface is damaged, cracked, cratered."
3118,Pilot plant complex,Unknown,Unknown,Unsafe Action,Unknown,เลือกการใช้ Man Basket แต่ไม่ได้ระบุ ตามหัวข้อ ตามLifting Plan ที่กำหนดไว้,1,เลือกการใช้ man basket แต่ไม่ได้ระบุ ตามหัวข้อ ตามlifting plan ที่กำหนดไว้,"Select the use of man basket, but do not specify the subject according to the specified lifting plan."
3119,Pilot plant complex,Unknown,Unknown,Unsafe Action,Unknown,"ผู้ขออนุญาตเลือกหัวข้อที่8 , 15.1 ไม่ถูกต้อง เพราะมีการทำงาน Hot work แบบชั้นบนมีช่องเปิด",1,"ผู้ขออนุญาตเลือกหัวข้อที่8 , 15.1 ไม่ถูกต้อง เพราะมีการทำงาน hot work แบบชั้นบนมีช่องเปิด","The applicant chooses item 8, 15.1 incorrect because there is a hot work on the upper floor with an opening."
3121,Ware house Site7,Unknown,Unknown,Unsafe Condition,Unknown,ตรวจพบสิ่งของวางไม่เป็นระเบียบ ไม่ถูกต้องตามหลัก 5 ส.,1,ตรวจพบสิ่งของวางไม่เป็นระเบียบ ไม่ถูกต้องตามหลัก 5 ส.,Found that the items were placed in a mess. Not correct according to 5 S.
3122,Ware house Site7,Unknown,Unknown,Unsafe Condition,Unknown,ตรวจพบจุดวางทินเนอร์ ไม่มี SDS ,1,ตรวจพบจุดวางทินเนอร์ ไม่มี sds,"Thinner point detected, no sds"
